215, CHITTAGONG, 200, SONALI BANK LTD., COURT HILL, 235, 200152358
215, CHITTAGONG, 200, SONALI BANK LTD., CUSTOM HOUSE, 238, 200152387
215, CHITTAGONG, 200, SONALI BANK LTD., DOHAZARI, 256, 200152561
215, CHITTAGONG, 200, SONALI BANK LTD., NAZIR HAT, 268, 200152682
215, CHITTAGONG, 200, SONALI BANK LTD., FATIKCHARI, 274, 200152745
215, CHITTAGONG, 200, SONALI BANK LTD., HALISHAHAR HOUSING ESTATE, 319, 200153199
215, CHITTAGONG, 200, SONALI BANK LTD., HATHAZARI, 322, 200153223
215, CHITTAGONG, 200, SONALI BANK LTD., JAMAL KHAN ROAD, 358, 200153586
215, CHITTAGONG, 200, SONALI BANK LTD., LALDIGHI CORPORATE, 370, 200153702
215, CHITTAGONG, 200, SONALI BANK LTD., KAGATIAHAT, 376, 200153760
215, CHITTAGONG, 200, SONALI BANK LTD., KALARPOLE, 379, 200153799
215, CHITTAGONG, 200, SONALI BANK LTD., KALIBARI, 382, 200153823
215, CHITTAGONG, 200, SONALI BANK LTD., KALUMUNSHIR HAT, 388, 200153881
215, CHITTAGONG, 200, SONALI BANK LTD., KALURGHAT INDUSTRIAL ESTATE, 394, 200153944
215, CHITTAGONG, 200, SONALI BANK LTD., KHAN BAHADUR BAZAR, 421, 200154219
215, CHITTAGONG, 200, SONALI BANK LTD., KHATUNGANJ, 427, 200154277
215, CHITTAGONG, 200, SONALI BANK LTD., KORBANIGANJ, 439, 200154398
215, CHITTAGONG, 200, SONALI BANK LTD., CDA RESIDENTIAL AREA, 448, 200154480
215, CHITTAGONG, 200, SONALI BANK LTD., LOHA GARA, 466, 200154664
215, CHITTAGONG, 200, SONALI BANK LTD., MAJIR GHAT, 481, 200154819
215, CHITTAGONG, 200, SONALI BANK LTD., MARIAMNAGAR, 484, 200154848
215, CHITTAGONG, 200, SONALI BANK LTD., MARINE ACADEMY, 487, 200154877
215, CHITTAGONG, 200, SONALI BANK LTD., MIRSARAI, 505, 200155050
215, CHITTAGONG, 200, SONALI BANK LTD., MITAGOLI, 511, 200155113
215, CHITTAGONG, 200, SONALI BANK LTD., MOHAMMED TAKIR HAT, 520, 200155205
215, CHITTAGONG, 200, SONALI BANK LTD., MOULVI BAZAR, 529, 200155292
215, CHITTAGONG, 200, SONALI BANK LTD., N.A. CHOWDHURY ROAD, 538, 200155384
215, CHITTAGONG, 200, SONALI BANK LTD., SARKERHAT, 541, 200155418
215, CHITTAGONG, 200, SONALI BANK LTD., NEW MARKET, 565, 200155650
215, CHITTAGONG, 200, SONALI BANK LTD., NIZAMPUR, 568, 200155689
215, CHITTAGONG, 200, SONALI BANK LTD., PAHARTALI MAIN ROAD, 598, 200155984
215, CHITTAGONG, 200, SONALI BANK LTD., PANCHLAISH, 604, 200156046
215, CHITTAGONG, 200, SONALI BANK LTD., PATIYA, 616, 200156167
215, CHITTAGONG, 200, SONALI BANK LTD., PORT, 622, 200156220
215, CHITTAGONG, 200, SONALI BANK LTD., RAILWAY BUILDING, 637, 200156370
215, CHITTAGONG, 200, SONALI BANK LTD., RANGUNIA, 640, 200156404
215, CHITTAGONG, 200, SONALI BANK LTD., RAOZAN, 649, 200156491
215, CHITTAGONG, 200, SONALI BANK LTD., REAZUDDIN BAZAR, 652, 200156525
215, CHITTAGONG, 200, SONALI BANK LTD., ROAZARHAT, 655, 200156554
215, CHITTAGONG, 200, SONALI BANK LTD., ROWSHAN HAT, 658, 200156583
215, CHITTAGONG, 200, SONALI BANK LTD., RUSTOM HAT, 667, 200156675
215, CHITTAGONG, 200, SONALI BANK LTD., SADARGHAT, 673, 200156738
215, CHITTAGONG, 200, SONALI BANK LTD., SANDWIP, 691, 200156912
215, CHITTAGONG, 200, SONALI BANK LTD., SATKANIA, 706, 200157061
215, CHITTAGONG, 200, SONALI BANK LTD., SHAH AMANAT INT. AIR PORT, 712, 200157124
215, CHITTAGONG, 200, SONALI BANK LTD., SIRAJUDDOWLA ROAD, 736, 200157366
215, CHITTAGONG, 200, SONALI BANK LTD., SITAKUNDA, 739, 200157395
215, CHITTAGONG, 200, SONALI BANK LTD., TERRI BAZAR, 763, 200157632
215, CHITTAGONG, 200, SONALI BANK LTD., WAGE EARNERS, 769, 200157690
418, CHUADANGA, 200, SONALI BANK LTD., ALAMDANGA, 004, 200180041
418, CHUADANGA, 200, SONALI BANK LTD., CHUADANGA, 019, 200180191
418, CHUADANGA, 200, SONALI BANK LTD., DAMURHUDA, 028, 200180283
418, CHUADANGA, 200, SONALI BANK LTD., DARSHANA, 031, 200180317
418, CHUADANGA, 200, SONALI BANK LTD., DINGEDAH, 034, 200180346
418, CHUADANGA, 200, SONALI BANK LTD., GOKUL KHALI, 040, 200180409
418, CHUADANGA, 200, SONALI BANK LTD., HAT BOALIA, 049, 200180496
418, CHUADANGA, 200, SONALI BANK LTD., JIBAN NAGAR, 058, 200180588
418, CHUADANGA, 200, SONALI BANK LTD., MUNSHIGANJ, 076, 200180762
418, CHUADANGA, 200, SONALI BANK LTD., SARATGANJ, 085, 200180854
418, CHUADANGA, 200, SONALI BANK LTD., UTHALI, 088, 200180883
119, COMILLA, 200, SONALI BANK LTD., ADDA BAZAR, 007, 200190073
119, COMILLA, 200, SONALI BANK LTD., TITAS, 018, 200190181
119, COMILLA, 200, SONALI BANK LTD., BARURA, 049, 200190499
119, COMILLA, 200, SONALI BANK LTD., BHARASHAR BAZAR, 061, 200190615
119, COMILLA, 200, SONALI BANK LTD., BISE BIDG., 067, 200190673
119, COMILLA, 200, SONALI BANK LTD., BRAHMAN PARA, 076, 200190765
119, COMILLA, 200, SONALI BANK LTD., BURICHANG, 082, 200190828
119, COMILLA, 200, SONALI BANK LTD., CHANDINA, 088, 200190886
119, COMILLA, 200, SONALI BANK LTD., CHOUDDAGRAM, 106, 200191069
119, COMILLA, 200, SONALI BANK LTD., COMILLA CANTONMENT, 121, 200191214
119, COMILLA, 200, SONALI BANK LTD., COMILLA COORPORATE, 127, 200191272
119, COMILLA, 200, SONALI BANK LTD., COMILLA SADAR DAKKHIN U.Z., 133, 200191335
119, COMILLA, 200, SONALI BANK LTD., COURT BUILDING, 145, 200191456
119, COMILLA, 200, SONALI BANK LTD., DAUDKANDI, 151, 200191519
119, COMILLA, 200, SONALI BANK LTD., DAULATGANJ, 154, 200191548
119, COMILLA, 200, SONALI BANK LTD., DEBIDWAR, 160, 200191601
119, COMILLA, 200, SONALI BANK LTD., ELIOTGANJ, 190, 200191906
119, COMILLA, 200, SONALI BANK LTD., GOURIPUR BAZAR, 211, 200192118
119, COMILLA, 200, SONALI BANK LTD., HOMNA, 223, 200192239
119, COMILLA, 200, SONALI BANK LTD., KANGSHANAGAR, 253, 200192534
119, COMILLA, 200, SONALI BANK LTD., KOTBARI, 265, 200192655
119, COMILLA, 200, SONALI BANK LTD., MEGHNA, 286, 200192868
119, COMILLA, 200, SONALI BANK LTD., MONOHARGONJ, 304, 200193041
119, COMILLA, 200, SONALI BANK LTD., MURAD NAGAR, 316, 200193162
119, COMILLA, 200, SONALI BANK LTD., NANGALKOT, 325, 200193254
119, COMILLA, 200, SONALI BANK LTD., NOA BAZAR, 337, 200193375
119, COMILLA, 200, SONALI BANK LTD., PARAMTALA, 343, 200193438
119, COMILLA, 200, SONALI BANK LTD., PAYALGACHA, 346, 200193467
119, COMILLA, 200, SONALI BANK LTD., RAIPUR BAZAR, 355, 200193559
119, COMILLA, 200, SONALI BANK LTD., RAMMOHAN BAZAR, 370, 200193704
119, COMILLA, 200, SONALI BANK LTD., COMPANIGANJ BAZAR, 373, 200193733
119, COMILLA, 200, SONALI BANK LTD., SRIKAIL, 397, 200193975
119, COMILLA, 200, SONALI BANK LTD., STATION ROAD, 400, 200194008
119, COMILLA, 200, SONALI BANK LTD., SUAGAZI, 403, 200194037
119, COMILLA, 200, SONALI BANK LTD., WAPDA BUILDING, 418, 200194187
222, COXS BAZAR, 200, SONALI BANK LTD., BADARKHALI, 004, 200220048
222, COXS BAZAR, 200, SONALI BANK LTD., CHAKARIA, 016, 200220169
222, COXS BAZAR, 200, SONALI BANK LTD., COXS BAZAR, 025, 200220251
222, COXS BAZAR, 200, SONALI BANK LTD., DULHAZRA, 037, 200220372
222, COXS BAZAR, 200, SONALI BANK LTD., EIDGAON, 040, 200220406
222, COXS BAZAR, 200, SONALI BANK LTD., KUTUBDIA, 067, 200220677
222, COXS BAZAR, 200, SONALI BANK LTD., MOHESHKHALI, 076, 200220769
222, COXS BAZAR, 200, SONALI BANK LTD., RAMU, 085, 200220851
222, COXS BAZAR, 200, SONALI BANK LTD., TEKNAF, 091, 200220914
222, COXS BAZAR, 200, SONALI BANK LTD., UKHIYA, 094, 200220943
126, DHAKA-NORTH, 200, SONALI BANK LTD., AGARGAON, 004, 200260040
126, DHAKA-NORTH, 200, SONALI BANK LTD., AMIN BAZAR, 013, 200260132
126, DHAKA-NORTH, 200, SONALI BANK LTD., ASHULIA BAZAR, 025, 200260253
126, DHAKA-NORTH, 200, SONALI BANK LTD., AWLAD HOSSAIN MARKET, 028, 200260282
126, DHAKA-NORTH, 200, SONALI BANK LTD., BADDA, 034, 200260345
126, DHAKA-NORTH, 200, SONALI BANK LTD., BANANI, 043, 200260437
126, DHAKA-NORTH, 200, SONALI BANK LTD., BANANI BAZAR, 046, 200260466
126, DHAKA-NORTH, 200, SONALI BANK LTD., BARIDHARA, 052, 200260529
126, DHAKA-NORTH, 200, SONALI BANK LTD., BAZME QUADERIA, 064, 200260640
126, DHAKA-NORTH, 200, SONALI BANK LTD., BEGUM ROKEYA SAWRANI, 067, 200260679
126, DHAKA-NORTH, 200, SONALI BANK LTD., COLLEGE GATE, 082, 200260824
126, DHAKA-NORTH, 200, SONALI BANK LTD., CUSTOM HOUSE, 088, 200260882
126, DHAKA-NORTH, 200, SONALI BANK LTD., DHAKA AIRPOT, 097, 200260974
126, DHAKA-NORTH, 200, SONALI BANK LTD., DHAKA CANTONMENT CORPORATE, 103, 200261036
126, DHAKA-NORTH, 200, SONALI BANK LTD., DHAKA EPZ, 109, 200261094
126, DHAKA-NORTH, 200, SONALI BANK LTD., DHAMRAI, 115, 200261157
126, DHAKA-NORTH, 200, SONALI BANK LTD., FARMGATE, 145, 200261452
126, DHAKA-NORTH, 200, SONALI BANK LTD., GANA BHABAN, 160, 200261607
126, DHAKA-NORTH, 200, SONALI BANK LTD., GREEN ROAD, 169, 200261694
126, DHAKA-NORTH, 200, SONALI BANK LTD., GULSHAN, 172, 200261728
126, DHAKA-NORTH, 200, SONALI BANK LTD., GULSHAN NEW NORTH CIRCLE, 187, 200261878
126, DHAKA-NORTH, 200, SONALI BANK LTD., HAZARIBAGH, 196, 200261960
126, DHAKA-NORTH, 200, SONALI BANK LTD., IBRAHIMPUR, 208, 200262080
126, DHAKA-NORTH, 200, SONALI BANK LTD., JATIO SANGSAD BHABAN, 229, 200262293
126, DHAKA-NORTH, 200, SONALI BANK LTD., JHIGATOLA, 232, 200262327
126, DHAKA-NORTH, 200, SONALI BANK LTD., KALAMPUR, 244, 200262448
126, DHAKA-NORTH, 200, SONALI BANK LTD., KALYAN PUR, 247, 200262477
126, DHAKA-NORTH, 200, SONALI BANK LTD., KARWAN BAZAR, 253, 200262530
126, DHAKA-NORTH, 200, SONALI BANK LTD., KRISHI BAZAR MOHAMMADPUR, 262, 200262622
126, DHAKA-NORTH, 200, SONALI BANK LTD., KURMITOLA, 265, 200262651
126, DHAKA-NORTH, 200, SONALI BANK LTD., DHANMONDI, 274, 200262743
126, DHAKA-NORTH, 200, SONALI BANK LTD., LALMATIA, 283, 200262835
126, DHAKA-NORTH, 200, SONALI BANK LTD., MANIK MIAH AVENUE, 289, 200262893
126, DHAKA-NORTH, 200, SONALI BANK LTD., MIRPUR CANTONMENT, 301, 200263018
126, DHAKA-NORTH, 200, SONALI BANK LTD., MIRPUR I/A, 304, 200263047
126, DHAKA-NORTH, 200, SONALI BANK LTD., MIRPUR SECTION-1, 310, 200263100
126, DHAKA-NORTH, 200, SONALI BANK LTD., MIRPUR SECTION-12, 316, 200263168
126, DHAKA-NORTH, 200, SONALI BANK LTD., MOHAKHALI, 319, 200263197
126, DHAKA-NORTH, 200, SONALI BANK LTD., MOHAMMADPUR BAZAR, 331, 200263313
126, DHAKA-NORTH, 200, SONALI BANK LTD., NAVAL H/Q, 343, 200263434
126, DHAKA-NORTH, 200, SONALI BANK LTD., NAYARHAT, 346, 200263463
126, DHAKA-NORTH, 200, SONALI BANK LTD., NEW MARKET, 352, 200263526
126, DHAKA-NORTH, 200, SONALI BANK LTD., PRIME MINISTER'S OFFICE, 373, 200263739
126, DHAKA-NORTH, 200, SONALI BANK LTD., PUBLIC ADM. TRAINING CENTRE, 376, 200263768
126, DHAKA-NORTH, 200, SONALI BANK LTD., RAGISTRATION COMPLEX, 382, 200263821
126, DHAKA-NORTH, 200, SONALI BANK LTD., SATMASJID ROAD, 403, 200264033
126, DHAKA-NORTH, 200, SONALI BANK LTD., SAVAR, 409, 200264091
126, DHAKA-NORTH, 200, SONALI BANK LTD., SAVAR CANTONMENT, 418, 200264183
126, DHAKA-NORTH, 200, SONALI BANK LTD., SONARGOAN HOTEL, 439, 200264396
126, DHAKA-NORTH, 200, SONALI BANK LTD., TEJGAON INDUSTRIAL AREA, 451, 200264512
126, DHAKA-NORTH, 200, SONALI BANK LTD., UTTAR KHAN, 460, 200264604
126, DHAKA-NORTH, 200, SONALI BANK LTD., UTTARA MODEL TOWN, 469, 200264691
126, DHAKA-NORTH, 200, SONALI BANK LTD., HAZRAT SHAHJALA  INTERNATIONAL AIR PORT, 481, 200264817
127, DHAKA-SOUTH, 200, SONALI BANK LTD., TRUNCATION POINT, 000, 200270001
127, DHAKA-SOUTH, 200, SONALI BANK LTD., PANGAON INLAND CONTAINER TERMINAL, 011, 200270119
127, DHAKA-SOUTH, 200, SONALI BANK LTD., AGLA, 016, 200270164
127, DHAKA-SOUTH, 200, SONALI BANK LTD., AGRANI BALIKA BIDYALAYA, 019, 200270193
127, DHAKA-SOUTH, 200, SONALI BANK LTD., ARMANITOLA, 031, 200270319
127, DHAKA-SOUTH, 200, SONALI BANK LTD., ATI BAZAR, 034, 200270348
127, DHAKA-SOUTH, 200, SONALI BANK LTD., B. MADRASHA SHIKKHA BOARD, 040, 200270401
127, DHAKA-SOUTH, 200, SONALI BANK LTD., B.I.S.E., 046, 200270469
127, DHAKA-SOUTH, 200, SONALI BANK LTD., B.U.E.T., 052, 200270522
127, DHAKA-SOUTH, 200, SONALI BANK LTD., BABU BAZAR, 055, 200270551
127, DHAKA-SOUTH, 200, SONALI BANK LTD., BAITUL MOKARRAM, 061, 200270614
127, DHAKA-SOUTH, 200, SONALI BANK LTD., BANGA BANDHU NATIONAL STADIUM, 070, 200270706
127, DHAKA-SOUTH, 200, SONALI BANK LTD., BANGA BHABAN, 073, 200270735
127, DHAKA-SOUTH, 200, SONALI BANK LTD., BANGABANDHU AVENUE CORPORATE, 076, 200270764
127, DHAKA-SOUTH, 200, SONALI BANK LTD., BASHABOO, 097, 200270977
127, DHAKA-SOUTH, 200, SONALI BANK LTD., BAWANI NAGAR, 100, 200271000
127, DHAKA-SOUTH, 200, SONALI BANK LTD., CHAWK BAZAR, 127, 200271271
127, DHAKA-SOUTH, 200, SONALI BANK LTD., CHURAIN, 136, 200271363
127, DHAKA-SOUTH, 200, SONALI BANK LTD., DAYA GANJ, 145, 200271455
127, DHAKA-SOUTH, 200, SONALI BANK LTD., DHAKA SHERATON HOTEL, 163, 200271639
127, DHAKA-SOUTH, 200, SONALI BANK LTD., DHAKA UNIVERSITY CAMPUS, 175, 200271750
127, DHAKA-SOUTH, 200, SONALI BANK LTD., DILKUSHA CORPORATE, 193, 200271934
127, DHAKA-SOUTH, 200, SONALI BANK LTD., DISTILARY ROAD, 196, 200271963
127, DHAKA-SOUTH, 200, SONALI BANK LTD., DISTRICT COUNCIL HALL, 199, 200271992
127, DHAKA-SOUTH, 200, SONALI BANK LTD., FAKIRAPOOL, 217, 200272175
127, DHAKA-SOUTH, 200, SONALI BANK LTD., FARASHGANJ, 223, 200272238
127, DHAKA-SOUTH, 200, SONALI BANK LTD., FOREIGN EXCHANGE, 232, 200272320
127, DHAKA-SOUTH, 200, SONALI BANK LTD., GORAN, 247, 200272470
127, DHAKA-SOUTH, 200, SONALI BANK LTD., HEAD OFFICE, 268, 200272683
127, DHAKA-SOUTH, 200, SONALI BANK LTD., ISWAR CHANDRA ROAD, 304, 200273040
127, DHAKA-SOUTH, 200, SONALI BANK LTD., JATRABARI, 322, 200273224
127, DHAKA-SOUTH, 200, SONALI BANK LTD., JOYPARA, 328, 200273282
127, DHAKA-SOUTH, 200, SONALI BANK LTD., KAKRAIL, 337, 200273374
127, DHAKA-SOUTH, 200, SONALI BANK LTD., KALAKOPA, 340, 200273408
127, DHAKA-SOUTH, 200, SONALI BANK LTD., KALATIA, 343, 200273437
127, DHAKA-SOUTH, 200, SONALI BANK LTD., KAMALAPUR RAILWAY STATION, 355, 200273558
127, DHAKA-SOUTH, 200, SONALI BANK LTD., KERANIGANJ, 364, 200273640
127, DHAKA-SOUTH, 200, SONALI BANK LTD., KHILGAON, 367, 200273679
127, DHAKA-SOUTH, 200, SONALI BANK LTD., KRISHI BHABAN, 376, 200273761
127, DHAKA-SOUTH, 200, SONALI BANK LTD., LALBAGH ROAD, 382, 200273824
127, DHAKA-SOUTH, 200, SONALI BANK LTD., LAXMI BAZAR, 385, 200273853
127, DHAKA-SOUTH, 200, SONALI BANK LTD., LOCAL OFFICE, 388, 200273882
127, DHAKA-SOUTH, 200, SONALI BANK LTD., MALIBAGH, 394, 200273945
127, DHAKA-SOUTH, 200, SONALI BANK LTD., MITFORD ROAD, 412, 200274128
127, DHAKA-SOUTH, 200, SONALI BANK LTD., MOGHBAZAR, 418, 200274186
127, DHAKA-SOUTH, 200, SONALI BANK LTD., MOKIM KATRA, 421, 200274210
127, DHAKA-SOUTH, 200, SONALI BANK LTD., N.C.T.B., 454, 200274544
127, DHAKA-SOUTH, 200, SONALI BANK LTD., NAGAR BHABAN, 457, 200274573
127, DHAKA-SOUTH, 200, SONALI BANK LTD., NAWABGANJ, 469, 200274694
127, DHAKA-SOUTH, 200, SONALI BANK LTD., NAWABPUR ROAD, 475, 200274757
127, DHAKA-SOUTH, 200, SONALI BANK LTD., NAYA BAZAR, 481, 200274810
127, DHAKA-SOUTH, 200, SONALI BANK LTD., NAZIMUDDIN ROAD, 493, 200274931
127, DHAKA-SOUTH, 200, SONALI BANK LTD., NAZIRA BAZAR, 496, 200274960
127, DHAKA-SOUTH, 200, SONALI BANK LTD., NORTH SOUTH ROAD, 511, 200275114
127, DHAKA-SOUTH, 200, SONALI BANK LTD., PALAM GANJ, 517, 200275172
127, DHAKA-SOUTH, 200, SONALI BANK LTD., POSTAGOLA, 532, 200275327
127, DHAKA-SOUTH, 200, SONALI BANK LTD., RAJUK BHABAN, 562, 200275622
127, DHAKA-SOUTH, 200, SONALI BANK LTD., RAMNA CORPORATE, 571, 200275714
127, DHAKA-SOUTH, 200, SONALI BANK LTD., RAMPURA, 574, 200275743
127, DHAKA-SOUTH, 200, SONALI BANK LTD., RASULPUR BAZAR, 577, 200275772
127, DHAKA-SOUTH, 200, SONALI BANK LTD., RUHITPUR, 583, 200275835
127, DHAKA-SOUTH, 200, SONALI BANK LTD., SADARGHAT CORPORATE, 595, 200275956
127, DHAKA-SOUTH, 200, SONALI BANK LTD., SAIDABAD BUS TERMINAL, 598, 200275985
127, DHAKA-SOUTH, 200, SONALI BANK LTD., SEGUN BAGICHA, 616, 200276168
127, DHAKA-SOUTH, 200, SONALI BANK LTD., SHAHJAHANPUR, 625, 200276250
127, DHAKA-SOUTH, 200, SONALI BANK LTD., SHILPA BHABAN CORPORATE, 643, 200276434
127, DHAKA-SOUTH, 200, SONALI BANK LTD., SONARGAON ROAD, 658, 200276584
127, DHAKA-SOUTH, 200, SONALI BANK LTD., SUPREME COURT, 661, 200276618
127, DHAKA-SOUTH, 200, SONALI BANK LTD., URDU ROAD, 679, 200276797
127, DHAKA-SOUTH, 200, SONALI BANK LTD., VIQUARUN NESA NOON SCHOOL, 688, 200276889
127, DHAKA-SOUTH, 200, SONALI BANK LTD., WAGE EARNERS CORPORATE, 691, 200276913
127, DHAKA-SOUTH, 200, SONALI BANK LTD., WAPDA BUILDING CORPORATE, 697, 200276971
127, DHAKA-SOUTH, 200, SONALI BANK LTD., WARI, 700, 200277004
728, DINAJPUR, 200, SONALI BANK LTD., AFTABGANJ, 004, 200280046
728, DINAJPUR, 200, SONALI BANK LTD., BARAPUKURIA KAILA KHANI, 016, 200280167
728, DINAJPUR, 200, SONALI BANK LTD., BHAVANIPUR BAZAR, 025, 200280259
728, DINAJPUR, 200, SONALI BANK LTD., BINNAKURI, 031, 200280312
728, DINAJPUR, 200, SONALI BANK LTD., BIRAMPUR, 034, 200280341
728, DINAJPUR, 200, SONALI BANK LTD., BIRGANJ, 037, 200280370
728, DINAJPUR, 200, SONALI BANK LTD., BIROL, 040, 200280404
728, DINAJPUR, 200, SONALI BANK LTD., CHIRIRBANDAR, 052, 200280525
728, DINAJPUR, 200, SONALI BANK LTD., COURT BUILDING, 055, 200280554
728, DINAJPUR, 200, SONALI BANK LTD., DINAJPUR CORPORATE, 070, 200280709
728, DINAJPUR, 200, SONALI BANK LTD., FARAKKABAD, 079, 200280796
728, DINAJPUR, 200, SONALI BANK LTD., GHORAGHAT, 082, 200280820
728, DINAJPUR, 200, SONALI BANK LTD., HAKIMPUR, 091, 200280912
728, DINAJPUR, 200, SONALI BANK LTD., HUGLI PARA, 097, 200280970
728, DINAJPUR, 200, SONALI BANK LTD., JOYNANDAHAT, 100, 200281003
728, DINAJPUR, 200, SONALI BANK LTD., KACHINIAHAT, 106, 200281061
728, DINAJPUR, 200, SONALI BANK LTD., KAHAROLE, 109, 200281090
728, DINAJPUR, 200, SONALI BANK LTD., KHANSAMA, 121, 200281216
728, DINAJPUR, 200, SONALI BANK LTD., MADHYAPARA HARD ROCK PROJECT, 133, 200281337
728, DINAJPUR, 200, SONALI BANK LTD., MILL ROAD(SETABGANJ), 145, 200281458
728, DINAJPUR, 200, SONALI BANK LTD., NAWABGANJ, 163, 200281632
728, DINAJPUR, 200, SONALI BANK LTD., OSMANPUR, 172, 200281724
728, DINAJPUR, 200, SONALI BANK LTD., PAKERHAT, 175, 200281753
728, DINAJPUR, 200, SONALI BANK LTD., PARBATIPUR, 181, 200281816
728, DINAJPUR, 200, SONALI BANK LTD., PHULBARI, 187, 200281874
728, DINAJPUR, 200, SONALI BANK LTD., PULHAT, 193, 200281937
728, DINAJPUR, 200, SONALI BANK LTD., RANIGANJ BAZAR, 205, 200282057
728, DINAJPUR, 200, SONALI BANK LTD., SETABGANJ, 217, 200282178
728, DINAJPUR, 200, SONALI BANK LTD., SHAHID MAHBUB CANTON, 220, 200282202
728, DINAJPUR, 200, SONALI BANK LTD., SHEIKPURA, 223, 200282231
728, DINAJPUR, 200, SONALI BANK LTD., STATION ROAD, 232, 200282323
728, DINAJPUR, 200, SONALI BANK LTD., SUIHARI, 235, 200282352
329, FARIDPUR, 200, SONALI BANK LTD., ALFADANGA, 004, 200290049
329, FARIDPUR, 200, SONALI BANK LTD., BHANGA, 028, 200290281
329, FARIDPUR, 200, SONALI BANK LTD., BISWA ZAKER MANJIL, 032, 200290328
329, FARIDPUR, 200, SONALI BANK LTD., BOALMARI, 034, 200290344
329, FARIDPUR, 200, SONALI BANK LTD., CHAR BHADRASAN, 043, 200290436
329, FARIDPUR, 200, SONALI BANK LTD., COURT BUILDING, 049, 200290494
329, FARIDPUR, 200, SONALI BANK LTD., FARIDPUR, 052, 200290528
329, FARIDPUR, 200, SONALI BANK LTD., GOALCHAMAT, 061, 200290610
329, FARIDPUR, 200, SONALI BANK LTD., HAJI GANJ, 070, 200290702
329, FARIDPUR, 200, SONALI BANK LTD., HATKRISHNAPUR, 073, 200290731
329, FARIDPUR, 200, SONALI BANK LTD., KAMARKHALI, 088, 200290881
329, FARIDPUR, 200, SONALI BANK LTD., KANAIPUR, 091, 200290915
329, FARIDPUR, 200, SONALI BANK LTD., KHALILPUR, 097, 200290973
329, FARIDPUR, 200, SONALI BANK LTD., MADHU KHALI UPA-ZILLA COMPLEX, 106, 200291064
329, FARIDPUR, 200, SONALI BANK LTD., MADHUKHALI, 109, 200291093
329, FARIDPUR, 200, SONALI BANK LTD., MOYENDIA BAZAR, 115, 200291156
329, FARIDPUR, 200, SONALI BANK LTD., NAGARKANDA, 118, 200291185
329, FARIDPUR, 200, SONALI BANK LTD., SADAR UPAZILA COMPLEX, 124, 200291248
329, FARIDPUR, 200, SONALI BANK LTD., SADARPUR, 127, 200291277
329, FARIDPUR, 200, SONALI BANK LTD., SALTA BAZAR, 130, 200291301
329, FARIDPUR, 200, SONALI BANK LTD., SHIRGRAM, 136, 200291369
329, FARIDPUR, 200, SONALI BANK LTD., TALMA, 142, 200291422
329, FARIDPUR, 200, SONALI BANK LTD., TEPAKHOLA, 145, 200291451
230, FENI, 200, SONALI BANK LTD., BAKTERMUNSHI, 019, 200300197
230, FENI, 200, SONALI BANK LTD., CHHAGALNAIYA, 031, 200300313
230, FENI, 200, SONALI BANK LTD., DAGANBHUIYAN, 037, 200300371
230, FENI, 200, SONALI BANK LTD., FENI, 052, 200300526
230, FENI, 200, SONALI BANK LTD., FULGAZI, 061, 200300618
230, FENI, 200, SONALI BANK LTD., GUTHUMA BAZAR, 067, 200300676
230, FENI, 200, SONALI BANK LTD., ISLAMPUR ROAD, 073, 200300739
230, FENI, 200, SONALI BANK LTD., LASKARHAT, 097, 200300971
230, FENI, 200, SONALI BANK LTD., LEMUA BAZAR, 100, 200301004
230, FENI, 200, SONALI BANK LTD., MATIAGODHA, 103, 200301033
230, FENI, 200, SONALI BANK LTD., MOHIPAL, 106, 200301062
230, FENI, 200, SONALI BANK LTD., MUNSHIRHAT, 115, 200301154
230, FENI, 200, SONALI BANK LTD., PANCHGACHIA, 124, 200301246
230, FENI, 200, SONALI BANK LTD., PARSHURAM, 127, 200301275
230, FENI, 200, SONALI BANK LTD., SADAR UPAZILA COMPLEX, 133, 200301338
230, FENI, 200, SONALI BANK LTD., SELONIA BAZAR, 142, 200301420
230, FENI, 200, SONALI BANK LTD., SONAGAZI, 148, 200301488
632, GAIBANDHA, 200, SONALI BANK LTD., BHARATKHALI, 016, 200320164
632, GAIBANDHA, 200, SONALI BANK LTD., BIRATHAT, 019, 200320193
632, GAIBANDHA, 200, SONALI BANK LTD., BONARPARA, 022, 200320227
632, GAIBANDHA, 200, SONALI BANK LTD., FASHITALA, 043, 200320430
632, GAIBANDHA, 200, SONALI BANK LTD., FULCHARI, 046, 200320469
632, GAIBANDHA, 200, SONALI BANK LTD., GAIBANDHA, 052, 200320522
632, GAIBANDHA, 200, SONALI BANK LTD., GOBINDAGANJ, 058, 200320580
632, GAIBANDHA, 200, SONALI BANK LTD., KAMARJANI, 067, 200320672
632, GAIBANDHA, 200, SONALI BANK LTD., KAMDIA, 073, 200320735
632, GAIBANDHA, 200, SONALI BANK LTD., D.B. ROAD, 091, 200320919
632, GAIBANDHA, 200, SONALI BANK LTD., MOHIMAGANJ, 097, 200320977
632, GAIBANDHA, 200, SONALI BANK LTD., PALASHBARI, 109, 200321097
632, GAIBANDHA, 200, SONALI BANK LTD., PURAN BAZAR, 118, 200321189
632, GAIBANDHA, 200, SONALI BANK LTD., SADULLAPUR, 124, 200321242
632, GAIBANDHA, 200, SONALI BANK LTD., SAGHATTA, 127, 200321271
632, GAIBANDHA, 200, SONALI BANK LTD., SUNDARGANJ, 130, 200321305
133, GAZIPUR, 200, SONALI BANK LTD., B.A.R.I., 010, 200330109
133, GAZIPUR, 200, SONALI BANK LTD., BARMIBAZAR, 013, 200330138
133, GAZIPUR, 200, SONALI BANK LTD., BHAWAL JAMALPUR, 019, 200330196
133, GAZIPUR, 200, SONALI BANK LTD., BOF GAZIPUR CANTT, 025, 200330259
133, GAZIPUR, 200, SONALI BANK LTD., BRRI, 031, 200330312
133, GAZIPUR, 200, SONALI BANK LTD., BSCIC I/A, 034, 200330341
133, GAZIPUR, 200, SONALI BANK LTD., BSMR AGR.UNIVERSITY, 037, 200330370
133, GAZIPUR, 200, SONALI BANK LTD., GAZIPUR COURT BUILDING, 058, 200330583
133, GAZIPUR, 200, SONALI BANK LTD., GAZIPUR SADAR THANA COMPLEX-2, 061, 200330617
133, GAZIPUR, 200, SONALI BANK LTD., JATIO BISWA BIDYALAYA, 070, 200330709
133, GAZIPUR, 200, SONALI BANK LTD., JOYDEBPUR, 073, 200330738
133, GAZIPUR, 200, SONALI BANK LTD., KALIAKOIR, 079, 200330796
133, GAZIPUR, 200, SONALI BANK LTD., KALIGANJ, 082, 200330820
133, GAZIPUR, 200, SONALI BANK LTD., KAPASIA, 088, 200330888
133, GAZIPUR, 200, SONALI BANK LTD., PUBAIL BAZAR, 127, 200331274
133, GAZIPUR, 200, SONALI BANK LTD., RAJENDRAPUR CANTONMENT, 133, 200331337
133, GAZIPUR, 200, SONALI BANK LTD., SHAFIPUR ANSAR ACADEMY COMPLEX, 145, 200331458
133, GAZIPUR, 200, SONALI BANK LTD., SINGHOSREE BAZAR, 147, 200331474
133, GAZIPUR, 200, SONALI BANK LTD., SREEPUR THANA H/Q., 151, 200331511
133, GAZIPUR, 200, SONALI BANK LTD., STATION ROAD, 154, 200331540
133, GAZIPUR, 200, SONALI BANK LTD., TONGI, 163, 200331632
133, GAZIPUR, 200, SONALI BANK LTD., TONGI BAZAR, 166, 200331661
435, GOPALGANJ, 200, SONALI BANK LTD., BANAGRAM BAZAR, 007, 200350071
435, GOPALGANJ, 200, SONALI BANK LTD., BASHBARIA BAZAR, 011, 200350118
435, GOPALGANJ, 200, SONALI BANK LTD., BHATIA PARA, 016, 200350163
435, GOPALGANJ, 200, SONALI BANK LTD., BOULTALI, 022, 200350226
435, GOPALGANJ, 200, SONALI BANK LTD., GHAGORE, 028, 200350284
435, GOPALGANJ, 200, SONALI BANK LTD., GOPALGANJ, 037, 200350376
435, GOPALGANJ, 200, SONALI BANK LTD., KASHIANI, 058, 200350589
435, GOPALGANJ, 200, SONALI BANK LTD., D.C. COMPLEX, 070, 200350705
435, GOPALGANJ, 200, SONALI BANK LTD., MUKSUDPUR, 073, 200350734
435, GOPALGANJ, 200, SONALI BANK LTD., PANCHURIA, 079, 200350792
435, GOPALGANJ, 200, SONALI BANK LTD., PATGATI, 082, 200350826
435, GOPALGANJ, 200, SONALI BANK LTD., TUNGI PARA, 109, 200351096
836, HABIGANJ, 200, SONALI BANK LTD., AJMIRIGANJ, 004, 200360045
836, HABIGANJ, 200, SONALI BANK LTD., AUSHKANDI, 010, 200360108
836, HABIGANJ, 200, SONALI BANK LTD., BAHUBAL, 013, 200360137
836, HABIGANJ, 200, SONALI BANK LTD., BANIACHANG, 016, 200360166
836, HABIGANJ, 200, SONALI BANK LTD., CHOWDHURIBAZAR, 028, 200360287
836, HABIGANJ, 200, SONALI BANK LTD., CHUNARUGHAT, 034, 200360340
836, HABIGANJ, 200, SONALI BANK LTD., ENAYETGANJ, 043, 200360432
836, HABIGANJ, 200, SONALI BANK LTD., HABIGANJ, 061, 200360616
836, HABIGANJ, 200, SONALI BANK LTD., KAKAILCHEO, 073, 200360737
836, HABIGANJ, 200, SONALI BANK LTD., LAKHAI, 085, 200360858
836, HABIGANJ, 200, SONALI BANK LTD., MADHABPUR, 088, 200360887
836, HABIGANJ, 200, SONALI BANK LTD., NABIGANJ, 109, 200361099
836, HABIGANJ, 200, SONALI BANK LTD., SHAYESTAGANJ, 139, 200361394
638, JOYPURHAT, 200, SONALI BANK LTD., AKKELPUR, 004, 200380041
638, JOYPURHAT, 200, SONALI BANK LTD., HATIL, 034, 200380346
638, JOYPURHAT, 200, SONALI BANK LTD., JOYPURHAT, 040, 200380409
638, JOYPURHAT, 200, SONALI BANK LTD., JOYPURHAT EAST, 043, 200380438
638, JOYPURHAT, 200, SONALI BANK LTD., KALAI, 046, 200380467
638, JOYPURHAT, 200, SONALI BANK LTD., KHETLAL, 049, 200380496
638, JOYPURHAT, 200, SONALI BANK LTD., PANCHBIBI, 067, 200380670
638, JOYPURHAT, 200, SONALI BANK LTD., PUNATHAT, 070, 200380704
139, JAMALPUR, 200, SONALI BANK LTD., BAKSHIGANJ, 010, 200390107
139, JAMALPUR, 200, SONALI BANK LTD., BSCIC INDUSTRIAL ESTATE, 037, 200390378
139, JAMALPUR, 200, SONALI BANK LTD., CHAPARKONA, 043, 200390431
139, JAMALPUR, 200, SONALI BANK LTD., DEWANGANJ BAZAR, 049, 200390499
139, JAMALPUR, 200, SONALI BANK LTD., DEWANGANJ SUGAR MILLS, 052, 200390523
139, JAMALPUR, 200, SONALI BANK LTD., HAZRA BARI, 073, 200390736
139, JAMALPUR, 200, SONALI BANK LTD., ISLAMPUR, 076, 200390765
139, JAMALPUR, 200, SONALI BANK LTD., JAMALPUR, 085, 200390857
