193, TANGAIL, 135, JANATA BANK LTD., NALLAPARA BAZAR, 018, 135930182
193, TANGAIL, 135, JANATA BANK LTD., AUSHNARA, 025, 135930258
193, TANGAIL, 135, JANATA BANK LTD., BHUANPUR, 046, 135930461
193, TANGAIL, 135, JANATA BANK LTD., BUS TERMINAL, 049, 135930490
193, TANGAIL, 135, JANATA BANK LTD., DEYPARA, 061, 135930616
193, TANGAIL, 135, JANATA BANK LTD., DHALAPARA, 064, 135930645
193, TANGAIL, 135, JANATA BANK LTD., DHIGAIR, 070, 135930708
193, TANGAIL, 135, JANATA BANK LTD., DURGAPUR, 076, 135930766
193, TANGAIL, 135, JANATA BANK LTD., GHATAIL, 091, 135930911
193, TANGAIL, 135, JANATA BANK LTD., HAMIDPUR, 109, 135931099
193, TANGAIL, 135, JANATA BANK LTD., KODIMDHOLLA, 143, 135931431
193, TANGAIL, 135, JANATA BANK LTD., MADHUPUR, 148, 135931486
193, TANGAIL, 135, JANATA BANK LTD., NAGARPUR, 169, 135931699
193, TANGAIL, 135, JANATA BANK LTD., NARANDIA, 175, 135931752
193, TANGAIL, 135, JANATA BANK LTD., PAIKSA, 182, 135931828
193, TANGAIL, 135, JANATA BANK LTD., PATHARGHATA, 193, 135931936
193, TANGAIL, 135, JANATA BANK LTD., RASULPUR, 202, 135932027
193, TANGAIL, 135, JANATA BANK LTD., TANGAIL, 229, 135932298
794, THAKURGAON, 135, JANATA BANK LTD., LAHIRIHAT, 061, 135940619
794, THAKURGAON, 135, JANATA BANK LTD., PIRGONJ BAZAR, 079, 135940798
794, THAKURGAON, 135, JANATA BANK LTD., RANISANKAIL, 082, 135940822
794, THAKURGAON, 135, JANATA BANK LTD., RUHEA, 085, 135940851
794, THAKURGAON, 135, JANATA BANK LTD., STATION BAZAR, 094, 135940943
794, THAKURGAON, 135, JANATA BANK LTD., THAKURGAON, 097, 135940972
306, BARISHAL, 140, MERCANTILE BANK LTD., BARISAL, 028, 140060289
309, BHOLA, 140, MERCANTILE BANK LTD., BHOLA, 010, 140090109
610, BOGRA, 140, MERCANTILE BANK LTD., BOGRA, 037, 140100378
112, BRAHMANBARIA, 140, MERCANTILE BANK LTD., ASHUGANJ, 010, 140120103
113, CHANDPUR, 140, MERCANTILE BANK LTD., CHANDPUR, 031, 140130319
113, CHANDPUR, 140, MERCANTILE BANK LTD., FARIDGANJ, 067, 140130672
215, CHITTAGONG, 140, MERCANTILE BANK LTD., AGRABAD, 013, 140150131
215, CHITTAGONG, 140, MERCANTILE BANK LTD., A K KHAN MOOR, 021, 140150210
215, CHITTAGONG, 140, MERCANTILE BANK LTD., BARAIYER HAT, 109, 140151093
215, CHITTAGONG, 140, MERCANTILE BANK LTD., CHITTAGONG EPZ, 200, 140152005
215, CHITTAGONG, 140, MERCANTILE BANK LTD., JUBILEE ROAD, 364, 140153646
215, CHITTAGONG, 140, MERCANTILE BANK LTD., KHATUNGANJ, 427, 140154274
215, CHITTAGONG, 140, MERCANTILE BANK LTD., KHULSHI, 436, 140154366
215, CHITTAGONG, 140, MERCANTILE BANK LTD., MADAM BIBIR HAT, 469, 140154690
215, CHITTAGONG, 140, MERCANTILE BANK LTD., O.R. NIZAM ROAD, 580, 140155802
215, CHITTAGONG, 140, MERCANTILE BANK LTD., PATHERHAT, 613, 140156135
215, CHITTAGONG, 140, MERCANTILE BANK LTD., PATIYA SME, 617, 140156177
215, CHITTAGONG, 140, MERCANTILE BANK LTD., SADARGHAT, 673, 140156735
215, CHITTAGONG, 140, MERCANTILE BANK LTD., SHAIK MUJIB ROAD, 721, 140157213
418, CHUADANGA, 140, MERCANTILE BANK LTD., CHUADANGA, 019, 140180198
119, COMILLA, 140, MERCANTILE BANK LTD., SHUAGANJ BAZAR, 023, 140190238
119, COMILLA, 140, MERCANTILE BANK LTD., COMILLA, 115, 140191158
222, COXS BAZAR, 140, MERCANTILE BANK LTD., JHILONGHA(COX'S BAZAR), 058, 140220582
126, DHAKA-NORTH, 140, MERCANTILE BANK LTD., INTERNATIONAL AIRPORT ROAD, 017, 140260171
126, DHAKA-NORTH, 140, MERCANTILE BANK LTD., ASAD GATE, 019, 140260197
126, DHAKA-NORTH, 140, MERCANTILE BANK LTD., ASHULIA, 022, 140260221
126, DHAKA-NORTH, 140, MERCANTILE BANK LTD., BANANI, 043, 140260434
126, DHAKA-NORTH, 140, MERCANTILE BANK LTD., BAIPAIL, 065, 140260650
126, DHAKA-NORTH, 140, MERCANTILE BANK LTD., GOURIPUR, 078, 140260784
126, DHAKA-NORTH, 140, MERCANTILE BANK LTD., DHANMONDI, 118, 140261183
126, DHAKA-NORTH, 140, MERCANTILE BANK LTD., ELEPHANT ROAD, 133, 140261338
126, DHAKA-NORTH, 140, MERCANTILE BANK LTD., ENGINEERS INSTITUTION, 137, 140261370
126, DHAKA-NORTH, 140, MERCANTILE BANK LTD., GARIB-E-NEWAZ AVENUE, 164, 140261646
126, DHAKA-NORTH, 140, MERCANTILE BANK LTD., GREEN ROAD, 169, 140261691
126, DHAKA-NORTH, 140, MERCANTILE BANK LTD., GULSHAN, 172, 140261725
126, DHAKA-NORTH, 140, MERCANTILE BANK LTD., HEMAYET PUR, 205, 140262058
126, DHAKA-NORTH, 140, MERCANTILE BANK LTD., KARWAN BAZAR, 253, 140262537
126, DHAKA-NORTH, 140, MERCANTILE BANK LTD., MAZAR ROAD, 290, 140262908
126, DHAKA-NORTH, 140, MERCANTILE BANK LTD., MIRPUR, 298, 140262982
126, DHAKA-NORTH, 140, MERCANTILE BANK LTD., MOHAKHALI, 319, 140263194
126, DHAKA-NORTH, 140, MERCANTILE BANK LTD., PRAGATI SARANI, 370, 140263707
126, DHAKA-NORTH, 140, MERCANTILE BANK LTD., RING ROAD, 397, 140263978
126, DHAKA-NORTH, 140, MERCANTILE BANK LTD., SATMASJID ROAD, 403, 140264030
126, DHAKA-NORTH, 140, MERCANTILE BANK LTD., UTTARA, 463, 140264630
127, DHAKA-SOUTH, 140, MERCANTILE BANK LTD., TRUNCATION POINT, 000, 140270008
127, DHAKA-SOUTH, 140, MERCANTILE BANK LTD., ABDULLAHPUR, 012, 140270129
127, DHAKA-SOUTH, 140, MERCANTILE BANK LTD., AGANAGAR, 013, 140270132
127, DHAKA-SOUTH, 140, MERCANTILE BANK LTD., ATI BAZAR, 034, 140270345
127, DHAKA-SOUTH, 140, MERCANTILE BANK LTD., BIJOY NAGAR, 109, 140271094
127, DHAKA-SOUTH, 140, MERCANTILE BANK LTD., DANIA, 142, 140271423
127, DHAKA-SOUTH, 140, MERCANTILE BANK LTD., DEMRA SME, 149, 140271494
127, DHAKA-SOUTH, 140, MERCANTILE BANK LTD., DHOLAIKHAL, 184, 140271849
127, DHAKA-SOUTH, 140, MERCANTILE BANK LTD., IMAMGANJ, 280, 140272806
127, DHAKA-SOUTH, 140, MERCANTILE BANK LTD., JOYPARA, 328, 140273289
127, DHAKA-SOUTH, 140, MERCANTILE BANK LTD., MOGHBAZAR, 418, 140274183
127, DHAKA-SOUTH, 140, MERCANTILE BANK LTD., MOTIJHEEL, 424, 140274246
127, DHAKA-SOUTH, 140, MERCANTILE BANK LTD., NAWABPUR, 472, 140274725
127, DHAKA-SOUTH, 140, MERCANTILE BANK LTD., NAYA BAZAR, 481, 140274817
127, DHAKA-SOUTH, 140, MERCANTILE BANK LTD., PRINCIPAL, 535, 140275353
127, DHAKA-SOUTH, 140, MERCANTILE BANK LTD., RAMPURA, 574, 140275740
728, DINAJPUR, 140, MERCANTILE BANK LTD., DINAJPUR, 067, 140280672
230, FENI, 140, MERCANTILE BANK LTD., DAGANBHUIYAN, 037, 140300378
230, FENI, 140, MERCANTILE BANK LTD., FENI, 052, 140300523
230, FENI, 140, MERCANTILE BANK LTD., KURAISH MUNSHI BAZAR, 092, 140300923
230, FENI, 140, MERCANTILE BANK LTD., RAJNAGAR SME, 140, 140301401
632, GAIBANDHA, 140, MERCANTILE BANK LTD., GOBINDAGANJ, 058, 140320587
133, GAZIPUR, 140, MERCANTILE BANK LTD., BOARD BAZAR, 022, 140330227
133, GAZIPUR, 140, MERCANTILE BANK LTD., GAZIPUR CHOWRASTA, 055, 140330551
133, GAZIPUR, 140, MERCANTILE BANK LTD., KONABARI, 094, 140330948
836, HABIGANJ, 140, MERCANTILE BANK LTD., NABIGANJ SME, 109, 140361096
441, JESSORE, 140, MERCANTILE BANK LTD., JESSORE, 094, 140410947
342, JHALOKATHI, 140, MERCANTILE BANK LTD., JHALOKATI, 031, 140420311
447, KHULNA, 140, MERCANTILE BANK LTD., SONADANGA, 262, 140472622
148, KISHOREGANJ, 140, MERCANTILE BANK LTD., KISHOREGANJ, 067, 140480672
450, KUSHTIA, 140, MERCANTILE BANK LTD., KUSHTIA, 094, 140500949
251, LAKSHMIPUR, 140, MERCANTILE BANK LTD., LAKSHMIPUR, 073, 140510739
251, LAKSHMIPUR, 140, MERCANTILE BANK LTD., MANDARI BAZAR, 082, 140510821
752, LALMONIRHAT, 140, MERCANTILE BANK LTD., LALMONIRHAT, 046, 140520466
354, MADARIPUR, 140, MERCANTILE BANK LTD., MADARIPUR, 040, 140540404
156, MANIKGANJ, 140, MERCANTILE BANK LTD., JHITKA BAZAR, 055, 140560550
858, MOULVI BAZAR, 140, MERCANTILE BANK LTD., MOULAVI BAZAR, 118, 140581184
161, MYMENSINGH, 140, MERCANTILE BANK LTD., MYMENSINGH, 175, 140611759
564, NAOGAON, 140, MERCANTILE BANK LTD., NAOGAON, 118, 140641187
564, NAOGAON, 140, MERCANTILE BANK LTD., NAZIPUR, 124, 140641240
564, NAOGAON, 140, MERCANTILE BANK LTD., NEAMATPUR, 127, 140641279
564, NAOGAON, 140, MERCANTILE BANK LTD., SAPAHAR, 175, 140641758
564, NAOGAON, 140, MERCANTILE BANK LTD., SHISHAHAT, 189, 140641895
167, NARAYANGANJ, 140, MERCANTILE BANK LTD., BHULTA, 022, 140670224
167, NARAYANGANJ, 140, MERCANTILE BANK LTD., MADANPUR, 097, 140670974
167, NARAYANGANJ, 140, MERCANTILE BANK LTD., NARAYANGANJ, 124, 140671249
167, NARAYANGANJ, 140, MERCANTILE BANK LTD., SHIMRAIL, 157, 140671573
168, NARSHINGDI, 140, MERCANTILE BANK LTD., VELA NAGAR, 139, 140681392
569, NATORE, 140, MERCANTILE BANK LTD., NATORE, 109, 140691090
570, NAWABGANJ, 140, MERCANTILE BANK LTD., CHAPAINAWABGANJ, 025, 140700257
773, NILPHAMARI, 140, MERCANTILE BANK LTD., NILPHAMARI, 073, 140730735
275, NOAKHALI, 140, MERCANTILE BANK LTD., AMISHAPARA SME, 010, 140750102
275, NOAKHALI, 140, MERCANTILE BANK LTD., BANGLA BAZAR, 019, 140750199
275, NOAKHALI, 140, MERCANTILE BANK LTD., BAZRA BAZAR, 031, 140750315
275, NOAKHALI, 140, MERCANTILE BANK LTD., CHOUMOHANI, 067, 140750678
275, NOAKHALI, 140, MERCANTILE BANK LTD., KANKIRHAT, 130, 140751301
275, NOAKHALI, 140, MERCANTILE BANK LTD., MAIJDEE COURT, 157, 140751572
275, NOAKHALI, 140, MERCANTILE BANK LTD., SAMIR MUNSHIR HAT, 199, 140751998
275, NOAKHALI, 140, MERCANTILE BANK LTD., SUBARNA CHAR, 235, 140752355
576, PABNA, 140, MERCANTILE BANK LTD., PABNA, 178, 140761788
777, PANCHAGARH, 140, MERCANTILE BANK LTD., DEBIGANJ, 019, 140770195
378, PATUAKHALI, 140, MERCANTILE BANK LTD., KALAYIA, 009, 140780093
378, PATUAKHALI, 140, MERCANTILE BANK LTD., PATUAKHALI, 109, 140781092
581, RAJSHAHI, 140, MERCANTILE BANK LTD., RAJSHAHI, 193, 140811933
284, RANGAMATI, 140, MERCANTILE BANK LTD., RANGAMATI, 052, 140840520
785, RANGPUR, 140, MERCANTILE BANK LTD., RANGPUR, 145, 140851456
386, SHARIATPUR, 140, MERCANTILE BANK LTD., BHAJESHWAR BAZAR, 007, 140860076
386, SHARIATPUR, 140, MERCANTILE BANK LTD., DAMUDYA, 019, 140860197
386, SHARIATPUR, 140, MERCANTILE BANK LTD., GOSHAIRHAT, 034, 140860342
890, SUNAMGANJ, 140, MERCANTILE BANK LTD., SUNAMGANJ, 112, 140901122
891, SYLHET, 140, MERCANTILE BANK LTD., BEANI BAZAR, 031, 140910313
891, SYLHET, 140, MERCANTILE BANK LTD., LALDIGHIRPAR, 250, 140912508
891, SYLHET, 140, MERCANTILE BANK LTD., SUBID BAZAR, 349, 140913499
193, TANGAIL, 140, MERCANTILE BANK LTD., GORAI, 103, 140931039
193, TANGAIL, 140, MERCANTILE BANK LTD., SHAKHIPUR, 220, 140932209
794, THAKURGAON, 140, MERCANTILE BANK LTD., THAKURGAON, 097, 140940970
306, BARISHAL, 145, MUTUAL TRUST BANK LTD., BARISAL, 028, 145060284
306, BARISHAL, 145, MUTUAL TRUST BANK LTD., GOURNADI, 082, 145060826
610, BOGRA, 145, MUTUAL TRUST BANK LTD., BOGRA, 037, 145100373
112, BRAHMANBARIA, 145, MUTUAL TRUST BANK LTD., BRAHMANBARIA, 043, 145120432
215, CHITTAGONG, 145, MUTUAL TRUST BANK LTD., ABUTORAB BAZAR, 010, 145150107
215, CHITTAGONG, 145, MUTUAL TRUST BANK LTD., AGRABAD, 013, 145150136
215, CHITTAGONG, 145, MUTUAL TRUST BANK LTD., ALANKAR MOR, 014, 145150149
215, CHITTAGONG, 145, MUTUAL TRUST BANK LTD., AMAN BAZAR, 025, 145150257
215, CHITTAGONG, 145, MUTUAL TRUST BANK LTD., KALURGHAT INDUSTRIAL AREA, 027, 145150273
215, CHITTAGONG, 145, MUTUAL TRUST BANK LTD., ANDERKILLA, 046, 145150460
215, CHITTAGONG, 145, MUTUAL TRUST BANK LTD., C.D.A. AVENUE, 148, 145151485
215, CHITTAGONG, 145, MUTUAL TRUST BANK LTD., CHITTAGONG MEDICAL COLLEGE, 202, 145152026
215, CHITTAGONG, 145, MUTUAL TRUST BANK LTD., JUBILEE ROAD, 364, 145153641
215, CHITTAGONG, 145, MUTUAL TRUST BANK LTD., KARNAPHULI EPZ, 407, 145154079
215, CHITTAGONG, 145, MUTUAL TRUST BANK LTD., KHATUNGANJ, 427, 145154279
215, CHITTAGONG, 145, MUTUAL TRUST BANK LTD., MURADPUR, 532, 145155328
215, CHITTAGONG, 145, MUTUAL TRUST BANK LTD., SARKERHAT, 541, 145155410
215, CHITTAGONG, 145, MUTUAL TRUST BANK LTD., NAZIR HAT, 559, 145155599
215, CHITTAGONG, 145, MUTUAL TRUST BANK LTD., NAZU MEA HAT SME, 563, 145155636
215, CHITTAGONG, 145, MUTUAL TRUST BANK LTD., OXYGEN MOUR, 587, 145155878
215, CHITTAGONG, 145, MUTUAL TRUST BANK LTD., KERANI HAAT, 786, 145157863
119, COMILLA, 145, MUTUAL TRUST BANK LTD., KADAIR BAZAR, 021, 145190217
119, COMILLA, 145, MUTUAL TRUST BANK LTD., GOALMARI BAZAR, 042, 145190420
119, COMILLA, 145, MUTUAL TRUST BANK LTD., COMILLA, 115, 145191153
119, COMILLA, 145, MUTUAL TRUST BANK LTD., DHORKORA BAZAR, 179, 145191795
119, COMILLA, 145, MUTUAL TRUST BANK LTD., LAKSAM SME, 272, 145192723
119, COMILLA, 145, MUTUAL TRUST BANK LTD., RAMCHANDRAPUR BAZAR SME, 365, 145193656
222, COXS BAZAR, 145, MUTUAL TRUST BANK LTD., CHAKARIA, 016, 145220161
222, COXS BAZAR, 145, MUTUAL TRUST BANK LTD., COXS BAZAR, 025, 145220253
126, DHAKA-NORTH, 145, MUTUAL TRUST BANK LTD., ASHULIA, 022, 145260226
126, DHAKA-NORTH, 145, MUTUAL TRUST BANK LTD., DUMNI, 036, 145260363
126, DHAKA-NORTH, 145, MUTUAL TRUST BANK LTD., BARAIPARA, 041, 145260413
126, DHAKA-NORTH, 145, MUTUAL TRUST BANK LTD., BANANI, 043, 145260439
126, DHAKA-NORTH, 145, MUTUAL TRUST BANK LTD., HEMAYET PUR, 050, 145260505
126, DHAKA-NORTH, 145, MUTUAL TRUST BANK LTD., BARIDHARA, 052, 145260521
126, DHAKA-NORTH, 145, MUTUAL TRUST BANK LTD., BASHUNDHARA, 055, 145260550
126, DHAKA-NORTH, 145, MUTUAL TRUST BANK LTD., BASHUNDHARA CITY, 058, 145260589
126, DHAKA-NORTH, 145, MUTUAL TRUST BANK LTD., DHANMONDI, 118, 145261188
126, DHAKA-NORTH, 145, MUTUAL TRUST BANK LTD., ELEPHANT ROAD, 133, 145261333
126, DHAKA-NORTH, 145, MUTUAL TRUST BANK LTD., GULSHAN, 172, 145261720
126, DHAKA-NORTH, 145, MUTUAL TRUST BANK LTD., MIRPUR, 298, 145262987
126, DHAKA-NORTH, 145, MUTUAL TRUST BANK LTD., MOHAMMADPUR, 328, 145263281
126, DHAKA-NORTH, 145, MUTUAL TRUST BANK LTD., PALLABI, 358, 145263586
126, DHAKA-NORTH, 145, MUTUAL TRUST BANK LTD., PANTHA PATH, 361, 145263610
126, DHAKA-NORTH, 145, MUTUAL TRUST BANK LTD., PRAGATI SARANI, 370, 145263702
126, DHAKA-NORTH, 145, MUTUAL TRUST BANK LTD., SAVAR, 409, 145264093
126, DHAKA-NORTH, 145, MUTUAL TRUST BANK LTD., SHAH MUKHDUM AVENUE, 422, 145264222
126, DHAKA-NORTH, 145, MUTUAL TRUST BANK LTD., TEJGAON, 448, 145264480
126, DHAKA-NORTH, 145, MUTUAL TRUST BANK LTD., UTTARA MODEL TOWN, 469, 145264693
126, DHAKA-NORTH, 145, MUTUAL TRUST BANK LTD., MTB CENTER CORPORATE, 485, 145264851
127, DHAKA-SOUTH, 145, MUTUAL TRUST BANK LTD., TRUNCATION POINT, 000, 145270003
127, DHAKA-SOUTH, 145, MUTUAL TRUST BANK LTD., AGANAGAR, 013, 145270137
127, DHAKA-SOUTH, 145, MUTUAL TRUST BANK LTD., MTB TOWER, 023, 145270232
127, DHAKA-SOUTH, 145, MUTUAL TRUST BANK LTD., BABU BAZAR, 055, 145270553
127, DHAKA-SOUTH, 145, MUTUAL TRUST BANK LTD., CHAWK MOGULTULY, 130, 145271307
127, DHAKA-SOUTH, 145, MUTUAL TRUST BANK LTD., DHOLAIKHAL, 184, 145271844
127, DHAKA-SOUTH, 145, MUTUAL TRUST BANK LTD., DILKUSHA, 190, 145271907
127, DHAKA-SOUTH, 145, MUTUAL TRUST BANK LTD., FULBARIA, 238, 145272380
127, DHAKA-SOUTH, 145, MUTUAL TRUST BANK LTD., HASNABAD SME, 258, 145272580
127, DHAKA-SOUTH, 145, MUTUAL TRUST BANK LTD., KAKRAIL, 337, 145273376
127, DHAKA-SOUTH, 145, MUTUAL TRUST BANK LTD., KAMRANGIRCHAR, 358, 145273589
127, DHAKA-SOUTH, 145, MUTUAL TRUST BANK LTD., MALIBAGH CHOWDHURYPARA, 397, 145273976
127, DHAKA-SOUTH, 145, MUTUAL TRUST BANK LTD., CARD DIVISION, 424, 145274241
127, DHAKA-SOUTH, 145, MUTUAL TRUST BANK LTD., PRINCIPAL, 535, 145275358
127, DHAKA-SOUTH, 145, MUTUAL TRUST BANK LTD., SARULIA BAZAR SME, 605, 145276052
127, DHAKA-SOUTH, 145, MUTUAL TRUST BANK LTD., DANIA, 631, 145276315
728, DINAJPUR, 145, MUTUAL TRUST BANK LTD., DINAJPUR, 067, 145280677
329, FARIDPUR, 145, MUTUAL TRUST BANK LTD., FARIDPUR, 052, 145290520
230, FENI, 145, MUTUAL TRUST BANK LTD., DAGANBHUIYAN, 037, 145300373
230, FENI, 145, MUTUAL TRUST BANK LTD., FENI, 052, 145300528
632, GAIBANDHA, 145, MUTUAL TRUST BANK LTD., GOBINDAGANJ, 058, 145320582
133, GAZIPUR, 145, MUTUAL TRUST BANK LTD., MONIPUR BAZAR, 014, 145330143
133, GAZIPUR, 145, MUTUAL TRUST BANK LTD., BAGHER BAZAR, 018, 145330185
133, GAZIPUR, 145, MUTUAL TRUST BANK LTD., BORMI BAZAR, 028, 145330280
133, GAZIPUR, 145, MUTUAL TRUST BANK LTD., CHANDRA, 040, 145330406
133, GAZIPUR, 145, MUTUAL TRUST BANK LTD., GAZIPUR, 052, 145330527
133, GAZIPUR, 145, MUTUAL TRUST BANK LTD., KALIGANJ, 082, 145330822
133, GAZIPUR, 145, MUTUAL TRUST BANK LTD., KAPASIA, 088, 145330880
133, GAZIPUR, 145, MUTUAL TRUST BANK LTD., TONGI, 163, 145331634
836, HABIGANJ, 145, MUTUAL TRUST BANK LTD., HABIGANJ, 061, 145360618
638, JOYPURHAT, 145, MUTUAL TRUST BANK LTD., JOYPURHAT, 040, 145380401
441, JESSORE, 145, MUTUAL TRUST BANK LTD., JESSORE, 094, 145410942
447, KHULNA, 145, MUTUAL TRUST BANK LTD., KHULNA, 154, 145471549
749, KURIGRAM, 145, MUTUAL TRUST BANK LTD., ULIPUR, 070, 145490704
450, KUSHTIA, 145, MUTUAL TRUST BANK LTD., KUSHTIA, 094, 145500944
251, LAKSHMIPUR, 145, MUTUAL TRUST BANK LTD., HAIDERGANJ, 052, 145510521
251, LAKSHMIPUR, 145, MUTUAL TRUST BANK LTD., RAIPUR, 097, 145510976
354, MADARIPUR, 145, MUTUAL TRUST BANK LTD., MADARIPUR, 040, 145540409
858, MOULVI BAZAR, 145, MUTUAL TRUST BANK LTD., MOULAVI BAZAR, 118, 145581189
159, MUNSHIGANJ, 145, MUTUAL TRUST BANK LTD., SREENAGAR, 142, 145591429
161, MYMENSINGH, 145, MUTUAL TRUST BANK LTD., GAFFARGAON SME, 101, 145611017
161, MYMENSINGH, 145, MUTUAL TRUST BANK LTD., JAMIRDIA MASTERBARI, 146, 145611462
161, MYMENSINGH, 145, MUTUAL TRUST BANK LTD., MYMENSINGH, 175, 145611754
564, NAOGAON, 145, MUTUAL TRUST BANK LTD., NAOGAON, 118, 145641182
167, NARAYANGANJ, 145, MUTUAL TRUST BANK LTD., NARAYANGANJ BSCIC, 023, 145670232
167, NARAYANGANJ, 145, MUTUAL TRUST BANK LTD., NARAYANGANJ, 118, 145671181
167, NARAYANGANJ, 145, MUTUAL TRUST BANK LTD., SONARGAON, 169, 145671699
167, NARAYANGANJ, 145, MUTUAL TRUST BANK LTD., MEGHNA, 286, 145672869
168, NARSHINGDI, 145, MUTUAL TRUST BANK LTD., MADHABDI, 067, 145680677
275, NOAKHALI, 145, MUTUAL TRUST BANK LTD., KHILPARA, 145, 145751456
576, PABNA, 145, MUTUAL TRUST BANK LTD., ISHWARDI SME, 122, 145761220
576, PABNA, 145, MUTUAL TRUST BANK LTD., PABNA, 178, 145761783
581, RAJSHAHI, 145, MUTUAL TRUST BANK LTD., RAJSHAHI, 193, 145811938
785, RANGPUR, 145, MUTUAL TRUST BANK LTD., RANGPUR, 145, 145851451
386, SHARIATPUR, 145, MUTUAL TRUST BANK LTD., NARIA SME, 059, 145860592
688, SIRAJGANJ, 145, MUTUAL TRUST BANK LTD., BELKUCHI SME, 023, 145880235
688, SIRAJGANJ, 145, MUTUAL TRUST BANK LTD., SERAJGANJ, 187, 145881876
890, SUNAMGANJ, 145, MUTUAL TRUST BANK LTD., SYEDPUR SME, 119, 145901198
891, SYLHET, 145, MUTUAL TRUST BANK LTD., LALDIGHIRPAR, 250, 145912503
891, SYLHET, 145, MUTUAL TRUST BANK LTD., SHAH PARAN GATE, 313, 145913131
891, SYLHET, 145, MUTUAL TRUST BANK LTD., SYLHET, 355, 145913557
193, TANGAIL, 145, MUTUAL TRUST BANK LTD., DHAN BARI SME, 068, 145930680
193, TANGAIL, 145, MUTUAL TRUST BANK LTD., TANGAIL, 229, 145932291
794, THAKURGAON, 145, MUTUAL TRUST BANK LTD., THAKURGAON, 097, 145940975
306, BARISHAL, 150, NATIONAL BANK LTD., BARISAL, 028, 150060282
306, BARISHAL, 150, NATIONAL BANK LTD., TORKI BANDAR, 221, 150062219
309, BHOLA, 150, NATIONAL BANK LTD., BHOLA, 010, 150090102
309, BHOLA, 150, NATIONAL BANK LTD., CHAR FASHION, 022, 150090223
610, BOGRA, 150, NATIONAL BANK LTD., BOGRA, 037, 150100371
112, BRAHMANBARIA, 150, NATIONAL BANK LTD., BRAHMANBARIA, 043, 150120430
112, BRAHMANBARIA, 150, NATIONAL BANK LTD., SOYFULLAHKANDI BAZAR, 130, 150121305
113, CHANDPUR, 150, NATIONAL BANK LTD., CHANDPUR NATUN BAZAR, 037, 150130370
113, CHANDPUR, 150, NATIONAL BANK LTD., HAJIGANJ, 088, 150130888
215, CHITTAGONG, 150, NATIONAL BANK LTD., AGRABAD, 013, 150150134
215, CHITTAGONG, 150, NATIONAL BANK LTD., ANDERKILLA, 046, 150150468
215, CHITTAGONG, 150, NATIONAL BANK LTD., BHATIARY, 121, 150151212
215, CHITTAGONG, 150, NATIONAL BANK LTD., C.D.A. AVENUE, 148, 150151483
215, CHITTAGONG, 150, NATIONAL BANK LTD., CHAKTAI, 175, 150151759
215, CHITTAGONG, 150, NATIONAL BANK LTD., CHAWK BAZAR, 193, 150151933
215, CHITTAGONG, 150, NATIONAL BANK LTD., HALISHAHAR, 316, 150153160
215, CHITTAGONG, 150, NATIONAL BANK LTD., HATHAZARI SME, 323, 150153236
215, CHITTAGONG, 150, NATIONAL BANK LTD., JUBILEE ROAD, 364, 150153649
215, CHITTAGONG, 150, NATIONAL BANK LTD., KHATUNGANJ, 427, 150154277
215, CHITTAGONG, 150, NATIONAL BANK LTD., MIRSARAI, 505, 150155050
215, CHITTAGONG, 150, NATIONAL BANK LTD., MURADPUR, 532, 150155326
215, CHITTAGONG, 150, NATIONAL BANK LTD., PAHARTALI, 592, 150155926
215, CHITTAGONG, 150, NATIONAL BANK LTD., PATIYA, 616, 150156167
215, CHITTAGONG, 150, NATIONAL BANK LTD., RANGUNIA, 640, 150156404
215, CHITTAGONG, 150, NATIONAL BANK LTD., SANDWIP, 691, 150156912
215, CHITTAGONG, 150, NATIONAL BANK LTD., SK. MUJIB ROAD, 742, 150157429
119, COMILLA, 150, NATIONAL BANK LTD., BARURA, 049, 150190499
119, COMILLA, 150, NATIONAL BANK LTD., BARURA SME, 050, 150190507
119, COMILLA, 150, NATIONAL BANK LTD., CHOUDDAGRAM, 106, 150191069
119, COMILLA, 150, NATIONAL BANK LTD., COMILLA, 115, 150191151
119, COMILLA, 150, NATIONAL BANK LTD., GOURIPUR BAZAR, 214, 150192147
119, COMILLA, 150, NATIONAL BANK LTD., MUDAFARGANJ, 313, 150193133
222, COXS BAZAR, 150, NATIONAL BANK LTD., COXS BAZAR, 025, 150220251
126, DHAKA-NORTH, 150, NATIONAL BANK LTD., ABDULLAHPUR BAZAR, 003, 150260037
126, DHAKA-NORTH, 150, NATIONAL BANK LTD., ASAD GATE, 019, 150260190
126, DHAKA-NORTH, 150, NATIONAL BANK LTD., ASHULIA, 022, 150260224
126, DHAKA-NORTH, 150, NATIONAL BANK LTD., SONARGAON JANAPATH, 024, 150260240
126, DHAKA-NORTH, 150, NATIONAL BANK LTD., SATURIA, 026, 150260266
126, DHAKA-NORTH, 150, NATIONAL BANK LTD., BANANI, 043, 150260437
126, DHAKA-NORTH, 150, NATIONAL BANK LTD., DHANMONDI, 118, 150261186
126, DHAKA-NORTH, 150, NATIONAL BANK LTD., ELEPHANT ROAD, 133, 150261331
126, DHAKA-NORTH, 150, NATIONAL BANK LTD., GULSHAN, 172, 150261728
126, DHAKA-NORTH, 150, NATIONAL BANK LTD., KARWAN BAZAR, 253, 150262530
126, DHAKA-NORTH, 150, NATIONAL BANK LTD., LAKE CIRCUS, 280, 150262806
126, DHAKA-NORTH, 150, NATIONAL BANK LTD., MIRPUR, 298, 150262985
126, DHAKA-NORTH, 150, NATIONAL BANK LTD., MOHAKHALI, 319, 150263197
126, DHAKA-NORTH, 150, NATIONAL BANK LTD., MOHAMMADPUR, 328, 150263289
126, DHAKA-NORTH, 150, NATIONAL BANK LTD., PRAGATI SARANI, 370, 150263700
126, DHAKA-NORTH, 150, NATIONAL BANK LTD., RIFLE SQUARE, 396, 150263968
126, DHAKA-NORTH, 150, NATIONAL BANK LTD., ROKEYA SHARANI, 400, 150264004
126, DHAKA-NORTH, 150, NATIONAL BANK LTD., SAVAR, 409, 150264091
126, DHAKA-NORTH, 150, NATIONAL BANK LTD., UTTARA, 463, 150264633
126, DHAKA-NORTH, 150, NATIONAL BANK LTD., Z.H.S.W. MEDICAL COLLEGE, 478, 150264783
127, DHAKA-SOUTH, 150, NATIONAL BANK LTD., TRUNCATION POINT, 000, 150270001
127, DHAKA-SOUTH, 150, NATIONAL BANK LTD., RAJENDRAPUR BAZAR, 029, 150270298
127, DHAKA-SOUTH, 150, NATIONAL BANK LTD., ATI BAZAR, 034, 150270348
127, DHAKA-SOUTH, 150, NATIONAL BANK LTD., BABU BAZAR, 055, 150270551
127, DHAKA-SOUTH, 150, NATIONAL BANK LTD., BANDURA, 064, 150270643
127, DHAKA-SOUTH, 150, NATIONAL BANK LTD., BANGSHAL, 088, 150270885
127, DHAKA-SOUTH, 150, NATIONAL BANK LTD., DILKUSHA, 190, 150271905
127, DHAKA-SOUTH, 150, NATIONAL BANK LTD., FOREIGN EXCHANGE, 232, 150272320
127, DHAKA-SOUTH, 150, NATIONAL BANK LTD., HEAD OFFICE, 268, 150272683
127, DHAKA-SOUTH, 150, NATIONAL BANK LTD., IMAMGANJ, 280, 150272809
127, DHAKA-SOUTH, 150, NATIONAL BANK LTD., ISLAMPUR, 298, 150272988
127, DHAKA-SOUTH, 150, NATIONAL BANK LTD., JATRABARI, 322, 150273224
127, DHAKA-SOUTH, 150, NATIONAL BANK LTD., JURAIN, 331, 150273316
127, DHAKA-SOUTH, 150, NATIONAL BANK LTD., KADAMTALI, 334, 150273345
127, DHAKA-SOUTH, 150, NATIONAL BANK LTD., KHOLAMORA BAZAR, 368, 150273682
127, DHAKA-SOUTH, 150, NATIONAL BANK LTD., MALIBAGH, 394, 150273945
127, DHAKA-SOUTH, 150, NATIONAL BANK LTD., MEGHULA, 404, 150274049
127, DHAKA-SOUTH, 150, NATIONAL BANK LTD., MIRHAJIRBAGH, 407, 150274078
127, DHAKA-SOUTH, 150, NATIONAL BANK LTD., MOTIJHEEL, 424, 150274249
127, DHAKA-SOUTH, 150, NATIONAL BANK LTD., NEW ESKATON ROAD, 503, 150275035
127, DHAKA-SOUTH, 150, NATIONAL BANK LTD., NORTH BROOK HALL ROAD, 505, 150275051
728, DINAJPUR, 150, NATIONAL BANK LTD., BIRAMPUR, 034, 150280341
728, DINAJPUR, 150, NATIONAL BANK LTD., DINAJPUR, 067, 150280675
329, FARIDPUR, 150, NATIONAL BANK LTD., BHANGA, 028, 150290281
329, FARIDPUR, 150, NATIONAL BANK LTD., BOALMARI SME, 035, 150290357
329, FARIDPUR, 150, NATIONAL BANK LTD., FARIDPUR, 052, 150290528
329, FARIDPUR, 150, NATIONAL BANK LTD., GOALCHAMAT, 061, 150290610
329, FARIDPUR, 150, NATIONAL BANK LTD., KANAIPUR BAZAR SME, 092, 150290928
230, FENI, 150, NATIONAL BANK LTD., DAGANBHUIYAN, 037, 150300371
230, FENI, 150, NATIONAL BANK LTD., FENI, 052, 150300526
230, FENI, 150, NATIONAL BANK LTD., SONAGAZI, 148, 150301488
632, GAIBANDHA, 150, NATIONAL BANK LTD., GAIBANDHA, 052, 150320522
133, GAZIPUR, 150, NATIONAL BANK LTD., GAZIPUR, 052, 150330525
133, GAZIPUR, 150, NATIONAL BANK LTD., JAINA BAZAR, 067, 150330675
133, GAZIPUR, 150, NATIONAL BANK LTD., KALIAKOIR, 079, 150330796
133, GAZIPUR, 150, NATIONAL BANK LTD., KAPASIA, 088, 150330888
133, GAZIPUR, 150, NATIONAL BANK LTD., TONGI, 167, 150331674
435, GOPALGANJ, 150, NATIONAL BANK LTD., GOPALGANJ, 037, 150350376
836, HABIGANJ, 150, NATIONAL BANK LTD., HABIGANJ, 061, 150360616
638, JOYPURHAT, 150, NATIONAL BANK LTD., JOYPURHAT, 040, 150380409
139, JAMALPUR, 150, NATIONAL BANK LTD., JAMALPUR, 085, 150390857
441, JESSORE, 150, NATIONAL BANK LTD., CHOWGACHA, 055, 150410553
441, JESSORE, 150, NATIONAL BANK LTD., JESSORE, 094, 150410940
342, JHALOKATHI, 150, NATIONAL BANK LTD., JHALOKATI, 031, 150420314
444, JHENAIDAH, 150, NATIONAL BANK LTD., JHENAIDAH, 064, 150440644
444, JHENAIDAH, 150, NATIONAL BANK LTD., KALIGANJ SME, 080, 150440802
447, KHULNA, 150, NATIONAL BANK LTD., KDA, 139, 150471392
447, KHULNA, 150, NATIONAL BANK LTD., KHULNA, 154, 150471547
148, KISHOREGANJ, 150, NATIONAL BANK LTD., BHAIRAB BAZAR, 022, 150480220
148, KISHOREGANJ, 150, NATIONAL BANK LTD., GOCHIHATA SME, 032, 150480325
148, KISHOREGANJ, 150, NATIONAL BANK LTD., KISHOREGANJ, 067, 150480675
148, KISHOREGANJ, 150, NATIONAL BANK LTD., PAKUNDIA SME, 108, 150481087
749, KURIGRAM, 150, NATIONAL BANK LTD., KURIGRAM, 040, 150490407
749, KURIGRAM, 150, NATIONAL BANK LTD., ROWMARI, 064, 150490649
450, KUSHTIA, 150, NATIONAL BANK LTD., KUSHTIA, 094, 150500942
752, LALMONIRHAT, 150, NATIONAL BANK LTD., BURIMARI, 019, 150520193
354, MADARIPUR, 150, NATIONAL BANK LTD., MADARIPUR, 040, 150540407
354, MADARIPUR, 150, NATIONAL BANK LTD., SHIBCHAR, 070, 150540702
156, MANIKGANJ, 150, NATIONAL BANK LTD., MANIKGANJ, 061, 150560616
