890, SUNAMGANJ, 035, BANGLADESH KRISHI BANK, MINA BAZAR, 070, 035900704
890, SUNAMGANJ, 035, BANGLADESH KRISHI BANK, MONGALKATA BAZAR, 071, 035900717
890, SUNAMGANJ, 035, BANGLADESH KRISHI BANK, MOINPUR BAZAR, 076, 035900762
890, SUNAMGANJ, 035, BANGLADESH KRISHI BANK, PATHARIA BAZAR, 088, 035900883
890, SUNAMGANJ, 035, BANGLADESH KRISHI BANK, RAJANIGANJ BAZAR, 091, 035900917
890, SUNAMGANJ, 035, BANGLADESH KRISHI BANK, RANIGANJ BAZAR, 094, 035900946
890, SUNAMGANJ, 035, BANGLADESH KRISHI BANK, SACHNA BAZAR, 100, 035901008
890, SUNAMGANJ, 035, BANGLADESH KRISHI BANK, SALLA, 103, 035901037
890, SUNAMGANJ, 035, BANGLADESH KRISHI BANK, SHYAMAR CHAR, 106, 035901066
890, SUNAMGANJ, 035, BANGLADESH KRISHI BANK, SUNAMGANJ, 112, 035901129
890, SUNAMGANJ, 035, BANGLADESH KRISHI BANK, TAHIRPUR, 121, 035901211
891, SYLHET, 035, BANGLADESH KRISHI BANK, AMBARKHANA, 004, 035910044
891, SYLHET, 035, BANGLADESH KRISHI BANK, BALAGANJ, 016, 035910165
891, SYLHET, 035, BANGLADESH KRISHI BANK, BANDAR BAZAR, 019, 035910194
891, SYLHET, 035, BANGLADESH KRISHI BANK, BEANI BAZAR, 031, 035910310
891, SYLHET, 035, BANGLADESH KRISHI BANK, BHABANIGANJ BAZAR, 034, 035910349
891, SYLHET, 035, BANGLADESH KRISHI BANK, BISHWANATH, 043, 035910431
891, SYLHET, 035, BANGLADESH KRISHI BANK, CHARKHAI, 070, 035910707
891, SYLHET, 035, BANGLADESH KRISHI BANK, CHOTULBAZAR, 076, 035910765
891, SYLHET, 035, BANGLADESH KRISHI BANK, COMPANIGANJ, 091, 035910910
891, SYLHET, 035, BANGLADESH KRISHI BANK, DARPANAGAR, 112, 035911122
891, SYLHET, 035, BANGLADESH KRISHI BANK, DEWAN BAZAR, 127, 035911272
891, SYLHET, 035, BANGLADESH KRISHI BANK, DOYAR BAZAR, 131, 035911319
891, SYLHET, 035, BANGLADESH KRISHI BANK, DUBAG BAZAR, 133, 035911335
891, SYLHET, 035, BANGLADESH KRISHI BANK, FENCHUGANJ, 136, 035911364
891, SYLHET, 035, BANGLADESH KRISHI BANK, GOLAPGANJ, 160, 035911601
891, SYLHET, 035, BANGLADESH KRISHI BANK, GOWAINGHAT, 166, 035911669
891, SYLHET, 035, BANGLADESH KRISHI BANK, HADARPAR BAZAR, 170, 035911706
891, SYLHET, 035, BANGLADESH KRISHI BANK, JAINTAPUR, 181, 035911814
891, SYLHET, 035, BANGLADESH KRISHI BANK, KANAIGHAT, 208, 035912084
891, SYLHET, 035, BANGLADESH KRISHI BANK, KHAJANCHIGAON, 226, 035912268
891, SYLHET, 035, BANGLADESH KRISHI BANK, MOGLA BAZAR, 268, 035912684
891, SYLHET, 035, BANGLADESH KRISHI BANK, RATANGANJ BAZAR, 301, 035913012
891, SYLHET, 035, BANGLADESH KRISHI BANK, SALUTIKAR, 310, 035913104
891, SYLHET, 035, BANGLADESH KRISHI BANK, SHIBER BAZAR, 337, 035913375
891, SYLHET, 035, BANGLADESH KRISHI BANK, SYLHET, 355, 035913559
891, SYLHET, 035, BANGLADESH KRISHI BANK, TAJPUR BAZAR, 384, 035913841
891, SYLHET, 035, BANGLADESH KRISHI BANK, ZAKIGANJ, 412, 035914129
193, TANGAIL, 035, BANGLADESH KRISHI BANK, MOGRA BAZAR, 008, 035930082
193, TANGAIL, 035, BANGLADESH KRISHI BANK, SHOLAKURI BAZAR, 009, 035930095
193, TANGAIL, 035, BANGLADESH KRISHI BANK, BATHULI SADI BAZAR, 012, 035930129
193, TANGAIL, 035, BANGLADESH KRISHI BANK, ALOKDIA, 013, 035930132
193, TANGAIL, 035, BANGLADESH KRISHI BANK, TOKTARCHALA BAZAR, 014, 035930145
193, TANGAIL, 035, BANGLADESH KRISHI BANK, SINGURIA BAZAR, 019, 035930190
193, TANGAIL, 035, BANGLADESH KRISHI BANK, AWLIABAD, 028, 035930282
193, TANGAIL, 035, BANGLADESH KRISHI BANK, BALLA BAZAR, 031, 035930316
193, TANGAIL, 035, BANGLADESH KRISHI BANK, BANGRA, 034, 035930345
193, TANGAIL, 035, BANGLADESH KRISHI BANK, BASAIL, 037, 035930374
193, TANGAIL, 035, BANGLADESH KRISHI BANK, BHABKHANDA BAZAR, 040, 035930408
193, TANGAIL, 035, BANGLADESH KRISHI BANK, BHADRA BAZAR, 043, 035930437
193, TANGAIL, 035, BANGLADESH KRISHI BANK, BHUANPUR, 046, 035930466
193, TANGAIL, 035, BANGLADESH KRISHI BANK, CHARPARA BAZAR, 052, 035930529
193, TANGAIL, 035, BANGLADESH KRISHI BANK, DELDUAR, 058, 035930587
193, TANGAIL, 035, BANGLADESH KRISHI BANK, DHAN BARI, 067, 035930679
193, TANGAIL, 035, BANGLADESH KRISHI BANK, ELENGA, 082, 035930824
193, TANGAIL, 035, BANGLADESH KRISHI BANK, GHATAIL, 091, 035930916
193, TANGAIL, 035, BANGLADESH KRISHI BANK, GOPALPUR, 100, 035931007
193, TANGAIL, 035, BANGLADESH KRISHI BANK, GOYHATTA BAZAR, 106, 035931065
193, TANGAIL, 035, BANGLADESH KRISHI BANK, HATUBHANGA, 112, 035931128
193, TANGAIL, 035, BANGLADESH KRISHI BANK, JHAWAIL, 121, 035931210
193, TANGAIL, 035, BANGLADESH KRISHI BANK, KACHUABAZAR, 124, 035931249
193, TANGAIL, 035, BANGLADESH KRISHI BANK, KAKRAID, 127, 035931278
193, TANGAIL, 035, BANGLADESH KRISHI BANK, KALIHATI, 130, 035931302
193, TANGAIL, 035, BANGLADESH KRISHI BANK, KARATIA, 136, 035931360
193, TANGAIL, 035, BANGLADESH KRISHI BANK, MADHUPUR, 148, 035931481
193, TANGAIL, 035, BANGLADESH KRISHI BANK, MIRZAPUR, 151, 035931515
193, TANGAIL, 035, BANGLADESH KRISHI BANK, NAGARPUR, 169, 035931694
193, TANGAIL, 035, BANGLADESH KRISHI BANK, NALUA BAZAR, 172, 035931728
193, TANGAIL, 035, BANGLADESH KRISHI BANK, PORABARI, 199, 035931999
193, TANGAIL, 035, BANGLADESH KRISHI BANK, SAHABATPUR BAZAR, 208, 035932080
193, TANGAIL, 035, BANGLADESH KRISHI BANK, SAJANPUR, 211, 035932114
193, TANGAIL, 035, BANGLADESH KRISHI BANK, SHAKHIPUR, 220, 035932206
193, TANGAIL, 035, BANGLADESH KRISHI BANK, SIMLA BAZAR, 223, 035932235
193, TANGAIL, 035, BANGLADESH KRISHI BANK, TANGAIL, 229, 035932293
127, DHAKA-SOUTH, 040, BANGLADESH SAMABAYA BANK LTD., TRUNCATION POINT, 000, 040270003
127, DHAKA-SOUTH, 040, BANGLADESH SAMABAYA BANK LTD., DHAKA, 151, 040271510
306, BARISHAL, 047, BANGLADESH DEVELOPMENT BANK LTD., BARISAL, 028, 047060287
610, BOGRA, 047, BANGLADESH DEVELOPMENT BANK LTD., BOGRA, 037, 047100376
610, BOGRA, 047, BANGLADESH DEVELOPMENT BANK LTD., MOKAMTALA, 193, 047101933
112, BRAHMANBARIA, 047, BANGLADESH DEVELOPMENT BANK LTD., ASHUGANJ, 010, 047120101
112, BRAHMANBARIA, 047, BANGLADESH DEVELOPMENT BANK LTD., BRAHMANBARIA, 043, 047120435
112, BRAHMANBARIA, 047, BANGLADESH DEVELOPMENT BANK LTD., NABINAGAR, 136, 047121368
215, CHITTAGONG, 047, BANGLADESH DEVELOPMENT BANK LTD., CHITTAGONG, 196, 047151967
215, CHITTAGONG, 047, BANGLADESH DEVELOPMENT BANK LTD., KHATUNGANJ, 427, 047154272
119, COMILLA, 047, BANGLADESH DEVELOPMENT BANK LTD., COMILLA, 115, 047191156
222, COXS BAZAR, 047, BANGLADESH DEVELOPMENT BANK LTD., COXS BAZAR, 025, 047220256
126, DHAKA-NORTH, 047, BANGLADESH DEVELOPMENT BANK LTD., ASHULIA, 022, 047260229
126, DHAKA-NORTH, 047, BANGLADESH DEVELOPMENT BANK LTD., HEMAYET PUR, 050, 047260508
126, DHAKA-NORTH, 047, BANGLADESH DEVELOPMENT BANK LTD., ELEPHANT ROAD, 133, 047261336
126, DHAKA-NORTH, 047, BANGLADESH DEVELOPMENT BANK LTD., KARWAN BAZAR, 256, 047262564
127, DHAKA-SOUTH, 047, BANGLADESH DEVELOPMENT BANK LTD., TRUNCATION POINT, 000, 047270006
127, DHAKA-SOUTH, 047, BANGLADESH DEVELOPMENT BANK LTD., KERANIGANJ, 009, 047270093
127, DHAKA-SOUTH, 047, BANGLADESH DEVELOPMENT BANK LTD., PRINCIPAL, 157, 047271571
127, DHAKA-SOUTH, 047, BANGLADESH DEVELOPMENT BANK LTD., MOTIJHEEL, 424, 047274244
728, DINAJPUR, 047, BANGLADESH DEVELOPMENT BANK LTD., DINAJPUR, 067, 047280670
329, FARIDPUR, 047, BANGLADESH DEVELOPMENT BANK LTD., FARIDPUR, 052, 047290523
133, GAZIPUR, 047, BANGLADESH DEVELOPMENT BANK LTD., JAINA BAZAR, 067, 047330670
836, HABIGANJ, 047, BANGLADESH DEVELOPMENT BANK LTD., HABIGANJ, 061, 047360611
441, JESSORE, 047, BANGLADESH DEVELOPMENT BANK LTD., JESSORE, 094, 047410945
444, JHENAIDAH, 047, BANGLADESH DEVELOPMENT BANK LTD., JHENAIDAH, 064, 047440649
447, KHULNA, 047, BANGLADESH DEVELOPMENT BANK LTD., KHULNA, 154, 047471542
148, KISHOREGANJ, 047, BANGLADESH DEVELOPMENT BANK LTD., HOSSAINPUR, 040, 047480409
156, MANIKGANJ, 047, BANGLADESH DEVELOPMENT BANK LTD., MOHADEBPUR, 070, 047560703
156, MANIKGANJ, 047, BANGLADESH DEVELOPMENT BANK LTD., SATURIA, 076, 047560761
858, MOULVI BAZAR, 047, BANGLADESH DEVELOPMENT BANK LTD., MOULAVI BAZAR, 118, 047581182
159, MUNSHIGANJ, 047, BANGLADESH DEVELOPMENT BANK LTD., SREENAGAR, 142, 047591422
161, MYMENSINGH, 047, BANGLADESH DEVELOPMENT BANK LTD., MYMENSINGH, 175, 047611757
564, NAOGAON, 047, BANGLADESH DEVELOPMENT BANK LTD., NAOGAON, 118, 047641185
167, NARAYANGANJ, 047, BANGLADESH DEVELOPMENT BANK LTD., KANCHPUR, 012, 047670127
167, NARAYANGANJ, 047, BANGLADESH DEVELOPMENT BANK LTD., NARAYANGANJ, 118, 047671184
168, NARSHINGDI, 047, BANGLADESH DEVELOPMENT BANK LTD., MADHABDI, 067, 047680670
773, NILPHAMARI, 047, BANGLADESH DEVELOPMENT BANK LTD., KAZIRHAT, 055, 047730559
275, NOAKHALI, 047, BANGLADESH DEVELOPMENT BANK LTD., NOAKHALI, 172, 047751725
576, PABNA, 047, BANGLADESH DEVELOPMENT BANK LTD., PABNA, 178, 047761786
581, RAJSHAHI, 047, BANGLADESH DEVELOPMENT BANK LTD., RAJSHAHI, 193, 047811931
785, RANGPUR, 047, BANGLADESH DEVELOPMENT BANK LTD., RANGPUR, 145, 047851454
891, SYLHET, 047, BANGLADESH DEVELOPMENT BANK LTD., OSMANI NAGAR, 014, 047910140
891, SYLHET, 047, BANGLADESH DEVELOPMENT BANK LTD., SYLHET, 355, 047913550
193, TANGAIL, 047, BANGLADESH DEVELOPMENT BANK LTD., TANGAIL, 229, 047932294
401, BAGERHAT, 055, BASIC BANK LTD., CHITALMARI, 022, 055010229
401, BAGERHAT, 055, BASIC BANK LTD., FAKIRHAT, 046, 055010461
306, BARISHAL, 055, BASIC BANK LTD., BARISAL, 028, 055060282
610, BOGRA, 055, BASIC BANK LTD., BOGRA, 037, 055100371
610, BOGRA, 055, BASIC BANK LTD., SERAJGANJ, 289, 055102890
113, CHANDPUR, 055, BASIC BANK LTD., CHANDPUR, 031, 055130312
215, CHITTAGONG, 055, BASIC BANK LTD., AGRABAD, 013, 055150134
215, CHITTAGONG, 055, BASIC BANK LTD., ASAD GANJ, 058, 055150589
215, CHITTAGONG, 055, BASIC BANK LTD., C.E.P.Z., 157, 055151575
215, CHITTAGONG, 055, BASIC BANK LTD., DEWAN HAT, 244, 055152440
215, CHITTAGONG, 055, BASIC BANK LTD., DOHAZARI, 256, 055152561
215, CHITTAGONG, 055, BASIC BANK LTD., JORARGANJ, 361, 055153610
215, CHITTAGONG, 055, BASIC BANK LTD., JUBILEE ROAD, 364, 055153649
215, CHITTAGONG, 055, BASIC BANK LTD., KHATUNGANJ, 427, 055154277
215, CHITTAGONG, 055, BASIC BANK LTD., PAHARTALI, 592, 055155926
215, CHITTAGONG, 055, BASIC BANK LTD., PATHERHAT, 613, 055156138
215, CHITTAGONG, 055, BASIC BANK LTD., SHOLA SAHAR, 733, 055157337
119, COMILLA, 055, BASIC BANK LTD., COMILLA, 115, 055191151
222, COXS BAZAR, 055, BASIC BANK LTD., COXS BAZAR, 025, 055220251
126, DHAKA-NORTH, 055, BASIC BANK LTD., BANANI, 043, 055260437
126, DHAKA-NORTH, 055, BASIC BANK LTD., BASHUNDHARA, 055, 055260558
126, DHAKA-NORTH, 055, BASIC BANK LTD., CANTONMENT, 073, 055260732
126, DHAKA-NORTH, 055, BASIC BANK LTD., DHANMONDI, 118, 055261186
126, DHAKA-NORTH, 055, BASIC BANK LTD., GULSHAN, 172, 055261728
126, DHAKA-NORTH, 055, BASIC BANK LTD., KARWAN BAZAR, 253, 055262530
126, DHAKA-NORTH, 055, BASIC BANK LTD., MIRPUR, 298, 055262985
126, DHAKA-NORTH, 055, BASIC BANK LTD., SAVAR, 409, 055264091
126, DHAKA-NORTH, 055, BASIC BANK LTD., SHYAMALI, 430, 055264309
126, DHAKA-NORTH, 055, BASIC BANK LTD., UTTARA, 463, 055264633
127, DHAKA-SOUTH, 055, BASIC BANK LTD., TRUNCATION POINT, 000, 055270001
127, DHAKA-SOUTH, 055, BASIC BANK LTD., BABU BAZAR, 055, 055270551
127, DHAKA-SOUTH, 055, BASIC BANK LTD., BANGSHAL, 088, 055270885
127, DHAKA-SOUTH, 055, BASIC BANK LTD., DHAKA(MAIN), 178, 055271789
127, DHAKA-SOUTH, 055, BASIC BANK LTD., DILKUSHA, 190, 055271905
127, DHAKA-SOUTH, 055, BASIC BANK LTD., HEAD OFFICE, 268, 055272683
127, DHAKA-SOUTH, 055, BASIC BANK LTD., ISLAMPUR, 298, 055272988
127, DHAKA-SOUTH, 055, BASIC BANK LTD., KERANIGANJ, 364, 055273640
127, DHAKA-SOUTH, 055, BASIC BANK LTD., MATUAIL, 400, 055274007
127, DHAKA-SOUTH, 055, BASIC BANK LTD., MOULVI BAZAR, 442, 055274423
127, DHAKA-SOUTH, 055, BASIC BANK LTD., SHANTINAGAR, 634, 055276342
329, FARIDPUR, 055, BASIC BANK LTD., FARIDPUR, 052, 055290528
133, GAZIPUR, 055, BASIC BANK LTD., GAZIPUR CHOWRASTA, 055, 055330554
133, GAZIPUR, 055, BASIC BANK LTD., MAWNA, 100, 055331003
435, GOPALGANJ, 055, BASIC BANK LTD., KOTALIPARA, 067, 055350671
435, GOPALGANJ, 055, BASIC BANK LTD., TUNGI PARA, 109, 055351096
836, HABIGANJ, 055, BASIC BANK LTD., MIRPUR BAZAR, 013, 055360137
441, JESSORE, 055, BASIC BANK LTD., JESSORE, 094, 055410940
441, JESSORE, 055, BASIC BANK LTD., JHIKORGHACHA, 109, 055411099
444, JHENAIDAH, 055, BASIC BANK LTD., JHENAIDAH, 064, 055440644
447, KHULNA, 055, BASIC BANK LTD., KDA AVENUE, 140, 055471400
447, KHULNA, 055, BASIC BANK LTD., KHULNA, 154, 055471547
450, KUSHTIA, 055, BASIC BANK LTD., KUSHTIA, 094, 055500942
858, MOULVI BAZAR, 055, BASIC BANK LTD., CHOUMUHANA, 037, 055580375
161, MYMENSINGH, 055, BASIC BANK LTD., ISHWARGANJ, 118, 055611181
161, MYMENSINGH, 055, BASIC BANK LTD., MYMENSINGH, 175, 055611752
167, NARAYANGANJ, 055, BASIC BANK LTD., TANBAZAR, 178, 055671789
168, NARSHINGDI, 055, BASIC BANK LTD., MADHABDI SME, 068, 055680688
168, NARSHINGDI, 055, BASIC BANK LTD., NARSHINGDI, 085, 055680859
569, NATORE, 055, BASIC BANK LTD., NATORE, 109, 055691093
570, NAWABGANJ, 055, BASIC BANK LTD., CHAPAI NAWABGANJ, 025, 055700250
773, NILPHAMARI, 055, BASIC BANK LTD., SAYEDPUR, 079, 055730796
378, PATUAKHALI, 055, BASIC BANK LTD., MOHIPUR, 085, 055780854
379, PIROJPUR, 055, BASIC BANK LTD., MATHBARIA, 052, 055790523
581, RAJSHAHI, 055, BASIC BANK LTD., RAJSHAHI, 193, 055811936
785, RANGPUR, 055, BASIC BANK LTD., RANGPUR, 145, 055851459
487, SATKHIRA, 055, BASIC BANK LTD., SATKHIRA, 109, 055871097
688, SIRAJGANJ, 055, BASIC BANK LTD., BELKUCHI, 022, 055880220
891, SYLHET, 055, BASIC BANK LTD., SONARPARA, 345, 055913450
891, SYLHET, 055, BASIC BANK LTD., ZINDA BAZAR, 415, 055914154
193, TANGAIL, 055, BASIC BANK LTD., ELENGA, 082, 055930820
401, BAGERHAT, 060, BRAC BANK LTD., BAGERHAT SME, 008, 060010085
306, BARISHAL, 060, BRAC BANK LTD., BARISAL, 028, 060060280
309, BHOLA, 060, BRAC BANK LTD., BHOLA, 010, 060090100
610, BOGRA, 060, BRAC BANK LTD., CHARMATHA, 008, 060100087
610, BOGRA, 060, BRAC BANK LTD., BOGRA, 037, 060100379
610, BOGRA, 060, BRAC BANK LTD., SHERPUR, 274, 060102748
112, BRAHMANBARIA, 060, BRAC BANK LTD., BRAHMANBARIA, 043, 060120438
112, BRAHMANBARIA, 060, BRAC BANK LTD., KASBA, 103, 060121037
113, CHANDPUR, 060, BRAC BANK LTD., CHANDPUR, 031, 060130310
113, CHANDPUR, 060, BRAC BANK LTD., HAJIGANJ, 088, 060130886
215, CHITTAGONG, 060, BRAC BANK LTD., AGRABAD, 013, 060150132
215, CHITTAGONG, 060, BRAC BANK LTD., ASAD GANJ, 058, 060150587
215, CHITTAGONG, 060, BRAC BANK LTD., BAHADDAR HAT SME, 080, 060150808
215, CHITTAGONG, 060, BRAC BANK LTD., BANDARTILA, 094, 060150945
215, CHITTAGONG, 060, BRAC BANK LTD., C.D.A. AVENUE, 148, 060151481
215, CHITTAGONG, 060, BRAC BANK LTD., CHAWK BAZAR, 193, 060151931
215, CHITTAGONG, 060, BRAC BANK LTD., HALISHAHAR, 316, 060153168
215, CHITTAGONG, 060, BRAC BANK LTD., HATHAZARI SME, 323, 060153234
215, CHITTAGONG, 060, BRAC BANK LTD., KADAMTOLI SME, 374, 060153742
215, CHITTAGONG, 060, BRAC BANK LTD., KAZIR DEWRI, 415, 060154154
215, CHITTAGONG, 060, BRAC BANK LTD., LOHAGARA SME, 467, 060154675
215, CHITTAGONG, 060, BRAC BANK LTD., MADAM BIBIR HAT, 469, 060154691
215, CHITTAGONG, 060, BRAC BANK LTD., MOMIN ROAD, 526, 060155261
215, CHITTAGONG, 060, BRAC BANK LTD., MURADPUR, 532, 060155324
215, CHITTAGONG, 060, BRAC BANK LTD., NEW MARKET, 565, 060155658
215, CHITTAGONG, 060, BRAC BANK LTD., CHITTAGONG NEW MARKET, 567, 060155674
215, CHITTAGONG, 060, BRAC BANK LTD., PAHARTALI SME, 593, 060155937
215, CHITTAGONG, 060, BRAC BANK LTD., PATIYA, 616, 060156165
215, CHITTAGONG, 060, BRAC BANK LTD., RAOZAN SME, 650, 060156507
215, CHITTAGONG, 060, BRAC BANK LTD., SITAKUNDA, 739, 060157393
215, CHITTAGONG, 060, BRAC BANK LTD., SK. MUJIB ROAD, 742, 060157427
418, CHUADANGA, 060, BRAC BANK LTD., JIBAN NAGAR, 006, 060180065
418, CHUADANGA, 060, BRAC BANK LTD., CHUADANGA, 019, 060180199
119, COMILLA, 060, BRAC BANK LTD., BARURA, 049, 060190497
119, COMILLA, 060, BRAC BANK LTD., CHANDINA, 088, 060190884
119, COMILLA, 060, BRAC BANK LTD., COMILLA, 115, 060191159
119, COMILLA, 060, BRAC BANK LTD., COMILLA SME, 116, 060191162
119, COMILLA, 060, BRAC BANK LTD., GOURIPUR SME, 212, 060192129
119, COMILLA, 060, BRAC BANK LTD., LAKSAM, 271, 060192716
222, COXS BAZAR, 060, BRAC BANK LTD., CHAKARIA, 016, 060220167
222, COXS BAZAR, 060, BRAC BANK LTD., COXS BAZAR, 025, 060220259
126, DHAKA-NORTH, 060, BRAC BANK LTD., ASHKONA, 020, 060260206
126, DHAKA-NORTH, 060, BRAC BANK LTD., ASHULIA, 022, 060260222
126, DHAKA-NORTH, 060, BRAC BANK LTD., BADDA SME, 035, 060260356
126, DHAKA-NORTH, 060, BRAC BANK LTD., UTTARA JASHIM UDDIN AVENUE, 038, 060260385
126, DHAKA-NORTH, 060, BRAC BANK LTD., BANANI, 043, 060260435
126, DHAKA-NORTH, 060, BRAC BANK LTD., HEMAYET PUR, 050, 060260501
126, DHAKA-NORTH, 060, BRAC BANK LTD., BASHUNDHARA, 055, 060260556
126, DHAKA-NORTH, 060, BRAC BANK LTD., BEGUM ROKEYA SAWRANI, 067, 060260677
126, DHAKA-NORTH, 060, BRAC BANK LTD., BANANI-11, 068, 060260680
126, DHAKA-NORTH, 060, BRAC BANK LTD., BONOSREE, 072, 060260727
126, DHAKA-NORTH, 060, BRAC BANK LTD., DAKSHIN KHAN, 091, 060260914
126, DHAKA-NORTH, 060, BRAC BANK LTD., ASAD GATE, 118, 060261184
126, DHAKA-NORTH, 060, BRAC BANK LTD., DHANMONDI, 120, 060261205
126, DHAKA-NORTH, 060, BRAC BANK LTD., ELEPHANT ROAD, 133, 060261339
126, DHAKA-NORTH, 060, BRAC BANK LTD., ELEPHANT ROAD SME, 135, 060261355
126, DHAKA-NORTH, 060, BRAC BANK LTD., ESKATON, 139, 060261397
126, DHAKA-NORTH, 060, BRAC BANK LTD., GULSHAN, 172, 060261726
126, DHAKA-NORTH, 060, BRAC BANK LTD., GULSHAN NORTH, 187, 060261876
126, DHAKA-NORTH, 060, BRAC BANK LTD., HAZARIBAGH SME, 197, 060261971
126, DHAKA-NORTH, 060, BRAC BANK LTD., MIRPUR SME, 199, 060261997
126, DHAKA-NORTH, 060, BRAC BANK LTD., KARWAN BAZAR SME, 254, 060262541
126, DHAKA-NORTH, 060, BRAC BANK LTD., MANDA, 287, 060262875
126, DHAKA-NORTH, 060, BRAC BANK LTD., MIRPUR, 298, 060262983
126, DHAKA-NORTH, 060, BRAC BANK LTD., MOHAMMADPUR SME, 329, 060263290
126, DHAKA-NORTH, 060, BRAC BANK LTD., NATUN BAZAR, 342, 060263429
126, DHAKA-NORTH, 060, BRAC BANK LTD., PANTHA PATH SME, 362, 060263629
126, DHAKA-NORTH, 060, BRAC BANK LTD., SAVAR, 409, 060264099
126, DHAKA-NORTH, 060, BRAC BANK LTD., SHYAMALI, 430, 060264307
126, DHAKA-NORTH, 060, BRAC BANK LTD., UTTARA, 463, 060264631
126, DHAKA-NORTH, 060, BRAC BANK LTD., UTTARA SME, 464, 060264644
127, DHAKA-SOUTH, 060, BRAC BANK LTD., TRUNCATION POINT, 000, 060270009
127, DHAKA-SOUTH, 060, BRAC BANK LTD., ATI BAZAR, 034, 060270346
127, DHAKA-SOUTH, 060, BRAC BANK LTD., BASHABOO SME, 098, 060270988
127, DHAKA-SOUTH, 060, BRAC BANK LTD., BIJOY NAGAR SME, 110, 060271103
127, DHAKA-SOUTH, 060, BRAC BANK LTD., DANIA, 142, 060271424
127, DHAKA-SOUTH, 060, BRAC BANK LTD., DEMRA SME, 149, 060271495
127, DHAKA-SOUTH, 060, BRAC BANK LTD., DHOLAIKHAL SME, 184, 060271840
127, DHAKA-SOUTH, 060, BRAC BANK LTD., DOHAR, 205, 060272052
127, DHAKA-SOUTH, 060, BRAC BANK LTD., GANAKBARI, 241, 060272410
127, DHAKA-SOUTH, 060, BRAC BANK LTD., GANDARIA, 244, 060272449
127, DHAKA-SOUTH, 060, BRAC BANK LTD., GRAPHICS BUILDING, 253, 060272531
127, DHAKA-SOUTH, 060, BRAC BANK LTD., GULISTAN SME, 254, 060272544
127, DHAKA-SOUTH, 060, BRAC BANK LTD., HEAD OFFICE, 268, 060272681
127, DHAKA-SOUTH, 060, BRAC BANK LTD., IMAMGANJ, 280, 060272807
127, DHAKA-SOUTH, 060, BRAC BANK LTD., ISLAMPUR, 298, 060272986
127, DHAKA-SOUTH, 060, BRAC BANK LTD., JATRABARI SME, 323, 060273235
127, DHAKA-SOUTH, 060, BRAC BANK LTD., KERANIGANJ, 364, 060273648
127, DHAKA-SOUTH, 060, BRAC BANK LTD., MITFORD, 406, 060274063
127, DHAKA-SOUTH, 060, BRAC BANK LTD., MOGHBAZAR, 418, 060274184
127, DHAKA-SOUTH, 060, BRAC BANK LTD., MOTIJHEEL, 424, 060274247
127, DHAKA-SOUTH, 060, BRAC BANK LTD., MOTIJHEEL SME, 428, 060274289
127, DHAKA-SOUTH, 060, BRAC BANK LTD., NAWABGANJ, 469, 060274692
127, DHAKA-SOUTH, 060, BRAC BANK LTD., NAWABPUR, 472, 060274726
127, DHAKA-SOUTH, 060, BRAC BANK LTD., RAMPURA, 574, 060275741
127, DHAKA-SOUTH, 060, BRAC BANK LTD., SATMASJID ROAD, 607, 060276074
127, DHAKA-SOUTH, 060, BRAC BANK LTD., SHAMBAZAR, 628, 060276287
127, DHAKA-SOUTH, 060, BRAC BANK LTD., SHYAMPUR SME, 653, 060276537
127, DHAKA-SOUTH, 060, BRAC BANK LTD., ZINZIRA, 709, 060277099
728, DINAJPUR, 060, BRAC BANK LTD., DINAJPUR, 067, 060280673
329, FARIDPUR, 060, BRAC BANK LTD., BHANGA, 028, 060290289
329, FARIDPUR, 060, BRAC BANK LTD., FARIDPUR, 052, 060290526
230, FENI, 060, BRAC BANK LTD., FENI, 052, 060300524
230, FENI, 060, BRAC BANK LTD., SONAGAZI, 148, 060301486
632, GAIBANDHA, 060, BRAC BANK LTD., GOBINDAGANJ, 058, 060320588
133, GAZIPUR, 060, BRAC BANK LTD., BOARD BAZAR, 022, 060330228
133, GAZIPUR, 060, BRAC BANK LTD., GAZIPUR, 052, 060330523
133, GAZIPUR, 060, BRAC BANK LTD., JOYDEBPUR, 073, 060330736
133, GAZIPUR, 060, BRAC BANK LTD., KAPASIA, 088, 060330886
133, GAZIPUR, 060, BRAC BANK LTD., KONABARI SME, 095, 060330952
133, GAZIPUR, 060, BRAC BANK LTD., MAWNA, 100, 060331001
133, GAZIPUR, 060, BRAC BANK LTD., TONGI, 163, 060331630
435, GOPALGANJ, 060, BRAC BANK LTD., GOPALGANJ, 037, 060350374
836, HABIGANJ, 060, BRAC BANK LTD., BANIACHANG, 016, 060360164
836, HABIGANJ, 060, BRAC BANK LTD., HABIGANJ, 061, 060360614
836, HABIGANJ, 060, BRAC BANK LTD., NABIGANJ, 109, 060361097
638, JOYPURHAT, 060, BRAC BANK LTD., JOYPURHAT, 040, 060380407
139, JAMALPUR, 060, BRAC BANK LTD., JAMALPUR, 085, 060390855
441, JESSORE, 060, BRAC BANK LTD., BENAPOLE SME, 029, 060410298
441, JESSORE, 060, BRAC BANK LTD., JESSORE, 094, 060410948
441, JESSORE, 060, BRAC BANK LTD., NOAPARA, 163, 060411639
342, JHALOKATHI, 060, BRAC BANK LTD., JHALOKATHI SME, 032, 060420325
444, JHENAIDAH, 060, BRAC BANK LTD., JHENAIDAH, 064, 060440642
447, KHULNA, 060, BRAC BANK LTD., BORO BAZAR, 037, 060470375
447, KHULNA, 060, BRAC BANK LTD., DAULATPUR, 070, 060470704
447, KHULNA, 060, BRAC BANK LTD., KHULNA, 154, 060471545
148, KISHOREGANJ, 060, BRAC BANK LTD., BHAIRAB, 019, 060480194
148, KISHOREGANJ, 060, BRAC BANK LTD., KISHOREGANJ, 067, 060480673
450, KUSHTIA, 060, BRAC BANK LTD., BHERAMARA, 028, 060500287
450, KUSHTIA, 060, BRAC BANK LTD., KUSHTIA, 094, 060500940
450, KUSHTIA, 060, BRAC BANK LTD., PORADAH, 136, 060501365
251, LAKSHMIPUR, 060, BRAC BANK LTD., LAKSHMIPUR, 073, 060510730
251, LAKSHMIPUR, 060, BRAC BANK LTD., RAIPUR, 097, 060510972
354, MADARIPUR, 060, BRAC BANK LTD., MADARIPUR, 040, 060540405
354, MADARIPUR, 060, BRAC BANK LTD., SHIBCHAR, 070, 060540700
455, MAGURA, 060, BRAC BANK LTD., MAGURA SME, 056, 060550561
156, MANIKGANJ, 060, BRAC BANK LTD., MANIKGANJ, 061, 060560614
275, NOAKHALI, 060, BRAC BANK LTD., MAIJDEE COURT, 157, 060571579
858, MOULVI BAZAR, 060, BRAC BANK LTD., MOULAVI BAZAR, 118, 060581185
159, MUNSHIGANJ, 060, BRAC BANK LTD., MUNSHIGANJ, 103, 060591038
159, MUNSHIGANJ, 060, BRAC BANK LTD., SREENAGAR, 142, 060591425
161, MYMENSINGH, 060, BRAC BANK LTD., MUKTAGACHA, 169, 060611697
161, MYMENSINGH, 060, BRAC BANK LTD., MYMENSINGH, 175, 060611750
564, NAOGAON, 060, BRAC BANK LTD., MOHADEBPUR, 109, 060641096
564, NAOGAON, 060, BRAC BANK LTD., NAOGAON SME, 119, 060641191
167, NARAYANGANJ, 060, BRAC BANK LTD., ARAIHAZAR SME, 005, 060670054
167, NARAYANGANJ, 060, BRAC BANK LTD., BHULTA SME, 023, 060670238
167, NARAYANGANJ, 060, BRAC BANK LTD., NARAYANGANJ, 118, 060671187
167, NARAYANGANJ, 060, BRAC BANK LTD., SIDDIRGANJ, 160, 060671608
167, NARAYANGANJ, 060, BRAC BANK LTD., SONARGAON, 169, 060671695
167, NARAYANGANJ, 060, BRAC BANK LTD., NITAIGANJ SME, 545, 060675459
168, NARSHINGDI, 060, BRAC BANK LTD., GHORASAL, 049, 060680499
168, NARSHINGDI, 060, BRAC BANK LTD., MADHABDI, 067, 060680673
168, NARSHINGDI, 060, BRAC BANK LTD., MONOHARDI, 073, 060680736
168, NARSHINGDI, 060, BRAC BANK LTD., NARSHINGDI, 085, 060680857
569, NATORE, 060, BRAC BANK LTD., NATORE, 109, 060691091
570, NAWABGANJ, 060, BRAC BANK LTD., CHAPAI NAWABGANJ SME, 026, 060700261
172, NETROKONA, 060, BRAC BANK LTD., NETROKONA SME, 074, 060720746
773, NILPHAMARI, 060, BRAC BANK LTD., NILPHAMARI, 073, 060730736
773, NILPHAMARI, 060, BRAC BANK LTD., SAYEDPUR, 079, 060730794
275, NOAKHALI, 060, BRAC BANK LTD., COMPANIGANJ, 015, 060750158
275, NOAKHALI, 060, BRAC BANK LTD., CHOUMOHANI, 067, 060750679
576, PABNA, 060, BRAC BANK LTD., ISHWARDI, 121, 060761213
576, PABNA, 060, BRAC BANK LTD., PABNA, 178, 060761789
777, PANCHAGARH, 060, BRAC BANK LTD., PANCHAGARH SME, 056, 060770567
378, PATUAKHALI, 060, BRAC BANK LTD., PATUAKHALI, 109, 060781093
379, PIROJPUR, 060, BRAC BANK LTD., PIROJPUR SME, 077, 060790776
379, PIROJPUR, 060, BRAC BANK LTD., SWARUPKATI SME, 098, 060790989
581, RAJSHAHI, 060, BRAC BANK LTD., RAJSHAHI, 193, 060811934
382, RAJBARI, 060, BRAC BANK LTD., RAJBARI, 073, 060820738
785, RANGPUR, 060, BRAC BANK LTD., RANGPUR, 145, 060851457
386, SHARIATPUR, 060, BRAC BANK LTD., BHEDERGANJ, 010, 060860101
487, SATKHIRA, 060, BRAC BANK LTD., SATKHIRA, 109, 060871095
688, SIRAJGANJ, 060, BRAC BANK LTD., BELKUCHI, 022, 060880228
688, SIRAJGANJ, 060, BRAC BANK LTD., SERAJGANJ SME, 188, 060881885
688, SIRAJGANJ, 060, BRAC BANK LTD., SHAHJADPUR, 190, 060881906
189, SHERPUR, 060, BRAC BANK LTD., SHERPUR, 055, 060890555
890, SUNAMGANJ, 060, BRAC BANK LTD., SUNAMGANJ, 112, 060901123
891, SYLHET, 060, BRAC BANK LTD., BEANI BAZAR, 031, 060910314
891, SYLHET, 060, BRAC BANK LTD., BISHWANATH, 043, 060910435
891, SYLHET, 060, BRAC BANK LTD., GOALA BAZAR, 154, 060911542
891, SYLHET, 060, BRAC BANK LTD., SYLHET SOUTH SURMA SME, 350, 060913508
891, SYLHET, 060, BRAC BANK LTD., SYLHET, 355, 060913553
891, SYLHET, 060, BRAC BANK LTD., SYLHET BONDOR SME, 356, 060913566
891, SYLHET, 060, BRAC BANK LTD., SYLHET UPASHAHAR, 373, 060913737
891, SYLHET, 060, BRAC BANK LTD., ZINDA BAZAR, 415, 060914152
193, TANGAIL, 060, BRAC BANK LTD., SHAKHIPUR, 220, 060932200
193, TANGAIL, 060, BRAC BANK LTD., GHATAIL SME, 229, 060932297
193, TANGAIL, 060, BRAC BANK LTD., TANGAIL, 230, 060932305
794, THAKURGAON, 060, BRAC BANK LTD., THAKURGAON SME, 099, 060940997
215, CHITTAGONG, 065, BANK AL-FALAH LTD, AGRABAD, 013, 065150137
126, DHAKA-NORTH, 065, BANK AL-FALAH LTD, DHANMONDI, 118, 065261189
126, DHAKA-NORTH, 065, BANK AL-FALAH LTD, GULSHAN, 172, 065261721
126, DHAKA-NORTH, 065, BANK AL-FALAH LTD, MIRPUR, 298, 065262988
126, DHAKA-NORTH, 065, BANK AL-FALAH LTD, UTTARA, 463, 065264636
127, DHAKA-SOUTH, 065, BANK AL-FALAH LTD, TRUNCATION POINT, 000, 065270004
